Product_A,Recommendation_1,Recommendation_2,Recommendation_3,Total_CoPurchase_Count,Total_Incremental_Revenue_Potential
JUMBO BAG RED RETROSPOT,JUMBO BAG STRAWBERRY,JUMBO STORAGE BAG SUKI,LUNCH BAG RED RETROSPOT,1273,113244.82999999975
JUMBO BAG PINK POLKADOT,JUMBO STORAGE BAG SUKI,JUMBO BAG RED RETROSPOT,JUMBO BAG STRAWBERRY,1120,108430.26999999984
REGENCY CAKESTAND 3 TIER,WHITE HANGING HEART T-LIGHT HOLDER,ROSES REGENCY TEACUP AND SAUCER ,SET OF 3 REGENCY CAKE TINS,904,100101.42999999989
GREEN REGENCY TEACUP AND SAUCER,REGENCY CAKESTAND 3 TIER,ROSES REGENCY TEACUP AND SAUCER ,PINK REGENCY TEACUP AND SAUCER,1375,95730.52000000014
PINK REGENCY TEACUP AND SAUCER,REGENCY CAKESTAND 3 TIER,ROSES REGENCY TEACUP AND SAUCER ,REGENCY TEAPOT ROSES ,876,76109.75000000012
PARTY BUNTING,REGENCY CAKESTAND 3 TIER,WHITE HANGING HEART T-LIGHT HOLDER,SPOTTY BUNTING,897,75393.39000000004
HEART OF WICKER LARGE,HEART OF WICKER SMALL,WHITE HANGING HEART T-LIGHT HOLDER,LARGE WHITE HEART OF WICKER,889,73117.29999999997
JUMBO BAG APPLES,LUNCH BAG APPLE DESIGN,JUMBO BAG RED RETROSPOT,JUMBO BAG PEARS,959,67196.45999999988
POSTAGE,ROUND SNACK BOXES SET OF4 WOODLAND ,REGENCY CAKESTAND 3 TIER,ROUND SNACK BOXES SET OF 4 FRUITS ,545,66304.95000000008
JUMBO  BAG BAROQUE BLACK WHITE,JUMBO BAG PINK POLKADOT,JUMBO STORAGE BAG SUKI,JUMBO BAG RED RETROSPOT,853,64771.799999999945
ALARM CLOCK BAKELIKE GREEN,ALARM CLOCK BAKELIKE PINK,ALARM CLOCK BAKELIKE RED ,ALARM CLOCK BAKELIKE IVORY,1148,64655.79
SET OF 3 CAKE TINS PANTRY DESIGN ,SET OF 6 SPICE TINS PANTRY DESIGN,WHITE HANGING HEART T-LIGHT HOLDER,SET OF TEA COFFEE SUGAR TINS PANTRY,709,62570.94000000009
JUMBO BAG ALPHABET,JUMBO BAG APPLES,JUMBO BAG RED RETROSPOT,JUMBO BAG VINTAGE LEAF,835,61532.679999999964
REGENCY SUGAR BOWL GREEN,REGENCY TEA PLATE ROSES ,REGENCY TEAPOT ROSES ,ROSES REGENCY TEACUP AND SAUCER ,491,58141.54999999999
JUMBO BAG OWLS,JUMBO BAG RED RETROSPOT,JUMBO STORAGE BAG SUKI,JUMBO BAG PINK POLKADOT,516,57195.619999999995
JUMBO BAG PINK VINTAGE PAISLEY,JUMBO BAG RED RETROSPOT,JUMBO SHOPPER VINTAGE RED PAISLEY,JUMBO BAG SCANDINAVIAN BLUE PAISLEY,827,57023.58999999998
REGENCY MILK JUG PINK ,REGENCY SUGAR BOWL GREEN,REGENCY TEAPOT ROSES ,ROSES REGENCY TEACUP AND SAUCER ,536,55457.40000000004
ASSORTED COLOUR BIRD ORNAMENT,REGENCY CAKESTAND 3 TIER,WHITE HANGING HEART T-LIGHT HOLDER,PAINTED METAL PEARS ASSORTED,757,54073.06000000009
JAM MAKING SET WITH JARS,RECIPE BOX PANTRY YELLOW DESIGN,SET OF 3 CAKE TINS PANTRY DESIGN ,SET OF 4 PANTRY JELLY MOULDS,616,51777.510000000046
DOORMAT FANCY FONT HOME SWEET HOME,DOORMAT HEARTS,DOORMAT RED RETROSPOT,DOORMAT NEW ENGLAND,286,49660.84
LUNCH BAG RED RETROSPOT,LUNCH BAG SPACEBOY DESIGN ,LUNCH BAG WOODLAND,LUNCH BAG SUKI DESIGN ,1350,49272.51999999999
DOLLY GIRL LUNCH BOX,LUNCH BAG SPACEBOY DESIGN ,SPACEBOY LUNCH BOX ,LUNCH BOX I LOVE LONDON,731,48784.849999999904
JAM MAKING SET PRINTED,JAM MAKING SET WITH JARS,REGENCY CAKESTAND 3 TIER,SET OF 3 CAKE TINS PANTRY DESIGN ,681,48615.089999999975
RED HANGING HEART T-LIGHT HOLDER,WHITE HANGING HEART T-LIGHT HOLDER,WOODEN PICTURE FRAME WHITE FINISH,SMALL WHITE HEART OF WICKER,641,48563.22000000004
PAPER CHAIN KIT 50'S CHRISTMAS ,PAPER CHAIN KIT RETROSPOT,PAPER CHAIN KIT VINTAGE CHRISTMAS,SET OF 20 VINTAGE CHRISTMAS NAPKINS,737,48272.77000000004
REGENCY TEA PLATE ROSES ,REGENCY TEAPOT ROSES ,ROSES REGENCY TEACUP AND SAUCER ,SET OF 3 REGENCY CAKE TINS,453,47712.79000000004
DOORMAT HEARTS,DOORMAT RED RETROSPOT,WHITE HANGING HEART T-LIGHT HOLDER,DOORMAT NEW ENGLAND,375,47620.15999999999
COOK WITH WINE METAL SIGN ,GIN + TONIC DIET METAL SIGN,HAND OVER THE CHOCOLATE   SIGN ,PLEASE ONE PERSON METAL SIGN,802,46924.08999999999
CHOCOLATE HOT WATER BOTTLE,HOT WATER BOTTLE I AM SO POORLY,HOT WATER BOTTLE TEA AND SYMPATHY,HOT WATER BOTTLE KEEP CALM,794,46891.76999999997
LUNCH BAG  BLACK SKULL.,LUNCH BAG CARS BLUE,LUNCH BAG RED RETROSPOT,LUNCH BAG PINK POLKADOT,1402,46675.00000000001
ALARM CLOCK BAKELIKE PINK,ALARM CLOCK BAKELIKE RED ,REGENCY CAKESTAND 3 TIER,SET OF 3 CAKE TINS PANTRY DESIGN ,601,44372.96
LUNCH BAG PINK POLKADOT,LUNCH BAG RED RETROSPOT,LUNCH BAG SPACEBOY DESIGN ,LUNCH BAG SUKI DESIGN ,1248,43913.27
DOORMAT FAIRY CAKE,DOORMAT HEARTS,DOORMAT RED RETROSPOT,DOORMAT NEW ENGLAND,223,43227.01
REGENCY TEAPOT ROSES ,ROSES REGENCY TEACUP AND SAUCER ,SPOTTY BUNTING,SET OF 3 REGENCY CAKE TINS,360,42885.019999999946
LUNCH BAG CARS BLUE,LUNCH BAG RED RETROSPOT,LUNCH BAG SPACEBOY DESIGN ,LUNCH BAG PINK POLKADOT,1276,42054.13000000002
HEART OF WICKER SMALL,NATURAL SLATE HEART CHALKBOARD ,WHITE HANGING HEART T-LIGHT HOLDER,SMALL WHITE HEART OF WICKER,633,41392.69
ROUND SNACK BOXES SET OF4 WOODLAND ,SPACEBOY LUNCH BOX ,STRAWBERRY LUNCH BOX WITH CUTLERY,WOODLAND CHARLOTTE BAG,370,40498.269999999975
JUMBO BAG DOILEY PATTERNS,LUNCH BAG DOILEY PATTERN ,JUMBO BAG RED RETROSPOT,JUMBO BAG VINTAGE LEAF,585,38675.36000000001
REGENCY TEA PLATE GREEN ,REGENCY TEA PLATE PINK,REGENCY TEA PLATE ROSES ,ROSES REGENCY TEACUP AND SAUCER ,582,38629.56000000007
EDWARDIAN PARASOL BLACK,EDWARDIAN PARASOL NATURAL,EDWARDIAN PARASOL RED,RED RETROSPOT UMBRELLA,368,38356.63999999999
LUNCH BAG APPLE DESIGN,LUNCH BAG RED RETROSPOT,LUNCH BAG SUKI DESIGN ,LUNCH BAG SPACEBOY DESIGN ,1059,37958.40000000001
ROUND SNACK BOXES SET OF 4 FRUITS ,ROUND SNACK BOXES SET OF4 WOODLAND ,SPACEBOY LUNCH BOX ,STRAWBERRY LUNCH BOX WITH CUTLERY,473,37917.86999999998
BAKING SET 9 PIECE RETROSPOT ,BAKING SET SPACEBOY DESIGN,RETROSPOT TEA SET CERAMIC 11 PC ,REGENCY CAKESTAND 3 TIER,672,37476.999999999985
JUMBO BAG PEARS,JUMBO BAG VINTAGE LEAF,LUNCH BAG APPLE DESIGN,JUMBO BAG RED RETROSPOT,610,36963.24000000002
DOORMAT NEW ENGLAND,DOORMAT RED RETROSPOT,WHITE HANGING HEART T-LIGHT HOLDER,DOORMAT SPOTTY HOME SWEET HOME,384,36873.89999999999
JUMBO BAG 50'S CHRISTMAS ,JUMBO BAG RED RETROSPOT,JUMBO BAG VINTAGE CHRISTMAS ,PAPER CHAIN KIT 50'S CHRISTMAS ,591,36784.41
PLASTERS IN TIN WOODLAND ANIMALS,ROUND SNACK BOXES SET OF4 WOODLAND ,POSTAGE,SPACEBOY LUNCH BOX ,370,36777.02999999997
HOMEMADE JAM SCENTED CANDLES,JAM MAKING SET WITH JARS,REGENCY CAKESTAND 3 TIER,SET OF 3 CAKE TINS PANTRY DESIGN ,346,34816.52999999997
JUMBO BAG VINTAGE DOILY ,LUNCH BAG RED RETROSPOT,LUNCH BAG VINTAGE DOILY ,JUMBO BAG VINTAGE LEAF,604,34652.61000000001
DOORMAT ENGLISH ROSE ,DOORMAT HEARTS,DOORMAT RED RETROSPOT,DOORMAT NEW ENGLAND,342,34555.65000000001
DOORMAT RED RETROSPOT,WHITE HANGING HEART T-LIGHT HOLDER,DOORMAT UNION FLAG,JUMBO BAG RED RETROSPOT,379,33820.88
DOORMAT BLACK FLOCK ,DOORMAT RED RETROSPOT,DOORMAT ENGLISH ROSE ,DOORMAT HEARTS,160,33670.93
HOT WATER BOTTLE KEEP CALM,HOT WATER BOTTLE TEA AND SYMPATHY,SCOTTIE DOG HOT WATER BOTTLE,LOVE HOT WATER BOTTLE,625,33596.199999999975
GIN + TONIC DIET METAL SIGN,PLEASE ONE PERSON METAL SIGN,HAND OVER THE CHOCOLATE   SIGN ,NO SINGING METAL SIGN,642,33475.979999999974
HAND WARMER OWL DESIGN,HAND WARMER SCOTTY DOG DESIGN,HAND WARMER UNION JACK,HAND WARMER RED LOVE HEART,693,33357.89999999997
BLACK RECORD COVER FRAME,"RECORD FRAME 7"" SINGLE SIZE ",REGENCY CAKESTAND 3 TIER,WHITE HANGING HEART T-LIGHT HOLDER,182,33000.17999999998
FELTCRAFT CUSHION BUTTERFLY,FELTCRAFT CUSHION OWL,FELTCRAFT CUSHION RABBIT,PINK CREAM FELT CRAFT TRINKET BOX ,452,32830.399999999994
LUNCH BAG DOLLY GIRL DESIGN,LUNCH BAG RED RETROSPOT,LUNCH BAG SPACEBOY DESIGN ,LUNCH BAG SUKI DESIGN ,920,32704.89000000002
JUMBO BAG SCANDINAVIAN BLUE PAISLEY,JUMBO BAG STRAWBERRY,JUMBO STORAGE BAG SUKI,JUMBO SHOPPER VINTAGE RED PAISLEY,504,32451.97000000002
ALARM CLOCK BAKELIKE IVORY,ALARM CLOCK BAKELIKE ORANGE,ALARM CLOCK BAKELIKE RED ,ALARM CLOCK BAKELIKE PINK,686,32272.4
WHITE HANGING HEART T-LIGHT HOLDER,WOODEN FRAME ANTIQUE WHITE ,WOODEN PICTURE FRAME WHITE FINISH,ZINC METAL HEART DECORATION,737,31953.389999999992
PACK OF 72 RETROSPOT CAKE CASES,PACK OF 72 SKULL CAKE CASES,SET/20 RED RETROSPOT PAPER NAPKINS ,REGENCY CAKESTAND 3 TIER,633,31746.760000000013
HAND WARMER BIRD DESIGN,HAND WARMER SCOTTY DOG DESIGN,HAND WARMER OWL DESIGN,HAND WARMER UNION JACK,670,31550.799999999963
JUMBO BAG STRAWBERRY,JUMBO STORAGE BAG SUKI,JUMBO SHOPPER VINTAGE RED PAISLEY,LUNCH BAG RED RETROSPOT,559,31234.120000000017
LUNCH BAG SPACEBOY DESIGN ,LUNCH BAG WOODLAND,LUNCH BAG SUKI DESIGN ,LUNCH BAG VINTAGE LEAF DESIGN,1008,30762.929999999993
WOOD 2 DRAWER CABINET WHITE FINISH,WOOD S/3 CABINET ANT WHITE FINISH,WOODEN FRAME ANTIQUE WHITE ,WOODEN PICTURE FRAME WHITE FINISH,551,30701.750000000007
DOORMAT KEEP CALM AND COME IN,DOORMAT UNION FLAG,GARDENERS KNEELING PAD KEEP CALM ,HOT WATER BOTTLE KEEP CALM,365,30637.46
CHILDRENS CUTLERY POLKADOT BLUE,CHILDRENS CUTLERY POLKADOT PINK,CHILDRENS CUTLERY POLKADOT GREEN ,CHILDRENS CUTLERY RETROSPOT RED ,355,30620.700000000004
ALARM CLOCK BAKELIKE ORANGE,ALARM CLOCK BAKELIKE RED ,ALARM CLOCK BAKELIKE PINK,REGENCY CAKESTAND 3 TIER,494,30521.379999999997
RABBIT NIGHT LIGHT,RED TOADSTOOL LED NIGHT LIGHT,RETROSPOT TEA SET CERAMIC 11 PC ,REGENCY CAKESTAND 3 TIER,279,30275.52999999999
JUMBO BAG VINTAGE LEAF,LUNCH BAG VINTAGE LEAF DESIGN,JUMBO STORAGE BAG SUKI,JUMBO SHOPPER VINTAGE RED PAISLEY,617,30127.059999999998
RECIPE BOX PANTRY YELLOW DESIGN,RECIPE BOX RETROSPOT ,SET OF 3 CAKE TINS PANTRY DESIGN ,SET OF 4 PANTRY JELLY MOULDS,644,30119.77999999996
GUMBALL COAT RACK,WHITE HANGING HEART T-LIGHT HOLDER,POSTAGE,REGENCY CAKESTAND 3 TIER,243,29952.29
RED RETROSPOT CAKE STAND,SET/5 RED RETROSPOT LID GLASS BOWLS,REGENCY CAKESTAND 3 TIER,WHITE HANGING HEART T-LIGHT HOLDER,308,29730.95000000001
IVORY KITCHEN SCALES,RED KITCHEN SCALES,MINT KITCHEN SCALES,SET OF 3 CAKE TINS PANTRY DESIGN ,601,29362.790000000008
NATURAL SLATE HEART CHALKBOARD ,WHITE HANGING HEART T-LIGHT HOLDER,REGENCY CAKESTAND 3 TIER,PARTY BUNTING,520,29191.779999999977
JUMBO SHOPPER VINTAGE RED PAISLEY,JUMBO STORAGE BAG SUKI,LUNCH BAG RED RETROSPOT,LUNCH BAG SUKI DESIGN ,601,29124.52000000002
ALARM CLOCK BAKELIKE CHOCOLATE,ALARM CLOCK BAKELIKE GREEN,ALARM CLOCK BAKELIKE PINK,ALARM CLOCK BAKELIKE RED ,611,28594.12
DOORMAT HOME SWEET HOME BLUE ,DOORMAT NEW ENGLAND,DOORMAT RED RETROSPOT,DOORMAT KEEP CALM AND COME IN,216,28509.559999999998
FELTCRAFT CUSHION OWL,FELTCRAFT CUSHION RABBIT,PINK CREAM FELT CRAFT TRINKET BOX ,RED FLORAL FELTCRAFT SHOULDER BAG,407,28498.47
LUNCH BAG ALPHABET DESIGN,LUNCH BAG APPLE DESIGN,LUNCH BAG RED RETROSPOT,LUNCH BAG SUKI DESIGN ,823,28388.140000000007
REGENCY TEA PLATE PINK,REGENCY TEA PLATE ROSES ,REGENCY TEAPOT ROSES ,ROSES REGENCY TEACUP AND SAUCER ,438,28150.250000000025
PLASTERS IN TIN CIRCUS PARADE ,PLASTERS IN TIN SPACEBOY,PLASTERS IN TIN STRONGMAN,PLASTERS IN TIN WOODLAND ANIMALS,720,28133.150000000034
HOT WATER BOTTLE I AM SO POORLY,HOT WATER BOTTLE TEA AND SYMPATHY,SCOTTIE DOG HOT WATER BOTTLE,HOT WATER BOTTLE KEEP CALM,535,27961.910000000007
60 CAKE CASES VINTAGE CHRISTMAS,PAPER CHAIN KIT 50'S CHRISTMAS ,PAPER CHAIN KIT VINTAGE CHRISTMAS,SET OF 20 VINTAGE CHRISTMAS NAPKINS,524,27644.68999999998
WOOD BLACK BOARD ANT WHITE FINISH,WOOD S/3 CABINET ANT WHITE FINISH,WOODEN FRAME ANTIQUE WHITE ,WOODEN PICTURE FRAME WHITE FINISH,375,27594.170000000006
BLUE HAPPY BIRTHDAY BUNTING,PINK HAPPY BIRTHDAY BUNTING,PARTY BUNTING,SPOTTY BUNTING,443,27360.50000000001
PLASTERS IN TIN SPACEBOY,PLASTERS IN TIN VINTAGE PAISLEY ,PLASTERS IN TIN WOODLAND ANIMALS,PLASTERS IN TIN STRONGMAN,666,27310.740000000034
LANDMARK FRAME COVENT GARDEN ,LANDMARK FRAME LONDON BRIDGE ,LANDMARK FRAME OXFORD STREET,LANDMARK FRAME NOTTING HILL ,98,26549.9
HOME BUILDING BLOCK WORD,LOVE BUILDING BLOCK WORD,WHITE HANGING HEART T-LIGHT HOLDER,WOODEN PICTURE FRAME WHITE FINISH,600,26076.58
FAIRY CAKE FLANNEL ASSORTED COLOUR,WHITE HANGING HEART T-LIGHT HOLDER,HOMEMADE JAM SCENTED CANDLES,GARDENERS KNEELING PAD KEEP CALM ,77,26038.469999999998
VINTAGE UNION JACK MEMOBOARD,WHITE HANGING HEART T-LIGHT HOLDER,WOOD BLACK BOARD ANT WHITE FINISH,WOODEN UNION JACK BUNTING,95,25533.21
RETROSPOT HEART HOT WATER BOTTLE,WHITE HANGING HEART T-LIGHT HOLDER,SCOTTIE DOG HOT WATER BOTTLE,WHITE SKULL HOT WATER BOTTLE ,411,25517.479999999996
BLACK HEART CARD HOLDER,CREAM HEART CARD HOLDER,NATURAL SLATE HEART CHALKBOARD ,WHITE HANGING HEART T-LIGHT HOLDER,193,25123.029999999988
SET OF 3 REGENCY CAKE TINS,SET OF TEA COFFEE SUGAR TINS PANTRY,SET OF 60 PANTRY DESIGN CAKE CASES ,SPOTTY BUNTING,354,25108.510000000013
JUMBO BAG WOODLAND ANIMALS,JUMBO SHOPPER VINTAGE RED PAISLEY,JUMBO STORAGE BAG SUKI,LUNCH BAG WOODLAND,469,24688.05000000001
60 TEATIME FAIRY CAKE CASES,PACK OF 60 DINOSAUR CAKE CASES,PACK OF 60 PINK PAISLEY CAKE CASES,PACK OF 72 RETROSPOT CAKE CASES,833,24460.959999999966
LANDMARK FRAME CAMDEN TOWN ,LANDMARK FRAME COVENT GARDEN ,LANDMARK FRAME LONDON BRIDGE ,LANDMARK FRAME OXFORD STREET,73,24430.7
HAND OVER THE CHOCOLATE   SIGN ,WHITE HANGING HEART T-LIGHT HOLDER,PLEASE ONE PERSON METAL SIGN,HOT BATHS METAL SIGN,526,24409.369999999995
RED TOADSTOOL LED NIGHT LIGHT,ROUND SNACK BOXES SET OF4 WOODLAND ,RETROSPOT TEA SET CERAMIC 11 PC ,WOODLAND CHARLOTTE BAG,246,24193.05000000001
ALARM CLOCK BAKELIKE RED ,RED DINER WALL CLOCK,ASSORTED COLOUR BIRD ORNAMENT,REGENCY CAKESTAND 3 TIER,394,24191.740000000013
SET OF 6 SPICE TINS PANTRY DESIGN,SET/5 RED RETROSPOT LID GLASS BOWLS,WHITE HANGING HEART T-LIGHT HOLDER,SET OF TEA COFFEE SUGAR TINS PANTRY,257,24170.86999999998
LUNCH BAG SUKI DESIGN ,LUNCH BAG WOODLAND,LUNCH BAG VINTAGE LEAF DESIGN,LUNCH BAG VINTAGE DOILY ,748,23991.010000000013
JUMBO STORAGE BAG SUKI,LUNCH BAG RED RETROSPOT,LUNCH BAG  BLACK SKULL.,LUNCH BAG SUKI DESIGN ,644,23883.800000000017
BLUE DINER WALL CLOCK,IVORY DINER WALL CLOCK,RED DINER WALL CLOCK,REGENCY CAKESTAND 3 TIER,432,23858.050000000003
BREAD BIN DINER STYLE IVORY,BREAD BIN DINER STYLE RED ,REGENCY CAKESTAND 3 TIER,IVORY KITCHEN SCALES,256,23647.56999999999
CIRCUS PARADE LUNCH BOX ,LUNCH BOX I LOVE LONDON,SPACEBOY LUNCH BOX ,DOLLY GIRL LUNCH BOX,393,23476.519999999997
LUNCH BAG WOODLAND,ROUND SNACK BOXES SET OF4 WOODLAND ,RED RETROSPOT CHARLOTTE BAG,WOODLAND CHARLOTTE BAG,464,23370.62000000001
ROSES REGENCY TEACUP AND SAUCER ,WHITE HANGING HEART T-LIGHT HOLDER,SET OF 3 CAKE TINS PANTRY DESIGN ,SET OF 3 REGENCY CAKE TINS,369,23014.670000000013
CHILDRENS CUTLERY POLKADOT PINK,CHILDRENS CUTLERY RETROSPOT RED ,LUNCH BAG RED RETROSPOT,CHILDRENS CUTLERY SPACEBOY ,320,22991.67
GARDENERS KNEELING PAD CUP OF TEA ,GARDENERS KNEELING PAD KEEP CALM ,WHITE HANGING HEART T-LIGHT HOLDER,KNEELING MAT HOUSEWORK  DESIGN,704,22857.52000000003
PLEASE ONE PERSON METAL SIGN,POTTERING IN THE SHED METAL SIGN,YOU'RE CONFUSING ME METAL SIGN ,WHITE HANGING HEART T-LIGHT HOLDER,414,22827.539999999994
BOX OF 6 MINI 50'S CRACKERS,BOX OF 6 MINI VINTAGE CRACKERS,GIANT 50'S CHRISTMAS CRACKER,PAPER CHAIN KIT 50'S CHRISTMAS ,440,22644.350000000006
36 DOILIES VINTAGE CHRISTMAS,SET OF 20 VINTAGE CHRISTMAS NAPKINS,60 CAKE CASES VINTAGE CHRISTMAS,PAPER CHAIN KIT VINTAGE CHRISTMAS,246,22635.780000000024
JUMBO BAG SPACEBOY DESIGN,LUNCH BAG SPACEBOY DESIGN ,LUNCH BAG RED RETROSPOT,JUMBO STORAGE BAG SUKI,513,22582.430000000026
LANDMARK FRAME BAKER STREET ,LANDMARK FRAME COVENT GARDEN ,LANDMARK FRAME OXFORD STREET,LANDMARK FRAME CAMDEN TOWN ,56,22447.8
SPOTTY BUNTING,VINTAGE UNION JACK BUNTING,WHITE HANGING HEART T-LIGHT HOLDER,WOODEN PICTURE FRAME WHITE FINISH,357,22267.249999999993
CHILDRENS CUTLERY POLKADOT GREEN ,CHILDRENS CUTLERY POLKADOT PINK,CHILDRENS CUTLERY RETROSPOT RED ,JUMBO BAG RED RETROSPOT,256,22255.429999999993
FELTCRAFT PRINCESS CHARLOTTE DOLL,FELTCRAFT PRINCESS OLIVIA DOLL,FELTCRAFT PRINCESS LOLA DOLL,PINK CREAM FELT CRAFT TRINKET BOX ,517,22247.129999999997
SPACEBOY LUNCH BOX ,WOODLAND CHARLOTTE BAG,STRAWBERRY LUNCH BOX WITH CUTLERY,WHITE HANGING HEART T-LIGHT HOLDER,255,22070.119999999995
6 RIBBONS RUSTIC CHARM,SCANDINAVIAN REDS RIBBONS,REGENCY CAKESTAND 3 TIER,WHITE HANGING HEART T-LIGHT HOLDER,411,22006.350000000006
WOODEN FRAME ANTIQUE WHITE ,WOODEN PICTURE FRAME WHITE FINISH,ZINC METAL HEART DECORATION,WOODEN HEART CHRISTMAS SCANDINAVIAN,562,22000.04000000001
PAPER BUNTING RETROSPOT,SET/20 RED RETROSPOT PAPER NAPKINS ,PAPER BUNTING VINTAGE PAISLEY,PARTY BUNTING,344,21941.450000000004
PAPER CHAIN KIT VINTAGE CHRISTMAS,SET OF 20 VINTAGE CHRISTMAS NAPKINS,SET OF 6 RIBBONS VINTAGE CHRISTMAS,VINTAGE CHRISTMAS BUNTING,386,21749.779999999988
FELTCRAFT 6 FLOWER FRIENDS,FELTCRAFT BUTTERFLY HEARTS,PINK BLUE FELT CRAFT TRINKET BOX,PINK CREAM FELT CRAFT TRINKET BOX ,337,21515.81
BOX OF 6 MINI VINTAGE CRACKERS,PAPER CHAIN KIT 50'S CHRISTMAS ,PAPER CHAIN KIT VINTAGE CHRISTMAS,SET OF 20 VINTAGE CHRISTMAS NAPKINS,360,21481.52000000001
HAND WARMER SCOTTY DOG DESIGN,HAND WARMER UNION JACK,SCOTTIE DOG HOT WATER BOTTLE,PAPER CHAIN KIT 50'S CHRISTMAS ,447,21422.42
PINK BLUE FELT CRAFT TRINKET BOX,WHITE HANGING HEART T-LIGHT HOLDER,PINK CREAM FELT CRAFT TRINKET BOX ,RED FLORAL FELTCRAFT SHOULDER BAG,408,21393.9
CHILLI LIGHTS,WHITE HANGING HEART T-LIGHT HOLDER,LUNCH BAG RED RETROSPOT,JUMBO BAG RED RETROSPOT,230,21348.92
LUNCH BOX WITH CUTLERY RETROSPOT ,STRAWBERRY LUNCH BOX WITH CUTLERY,POSTAGE,SKULL LUNCH BOX WITH CUTLERY ,357,20891.360000000015
 SPACEBOY BABY GIFT SET,DOLLY GIRL BABY GIFT SET,SPACEBOY LUNCH BOX ,CIRCUS PARADE BABY GIFT SET,177,20876.64999999998
CHRISTMAS CRAFT LITTLE FRIENDS,CHRISTMAS CRAFT TREE TOP ANGEL,PAPER CHAIN KIT 50'S CHRISTMAS ,CHRISTMAS CRAFT WHITE FAIRY ,544,20715.710000000006
FELTCRAFT BUTTERFLY HEARTS,FELTCRAFT CUSHION RABBIT,PINK BLUE FELT CRAFT TRINKET BOX,PINK CREAM FELT CRAFT TRINKET BOX ,329,20599.149999999998
LUNCH BOX I LOVE LONDON,SPACEBOY LUNCH BOX ,PACK OF 12 LONDON TISSUES ,WHITE HANGING HEART T-LIGHT HOLDER,382,20589.999999999993
EDWARDIAN PARASOL NATURAL,EDWARDIAN PARASOL RED,EDWARDIAN PARASOL PINK,RED RETROSPOT UMBRELLA,301,20297.34999999999
HAND WARMER RED RETROSPOT,HAND WARMER SCOTTY DOG DESIGN,HAND WARMER UNION JACK,HOT WATER BOTTLE KEEP CALM,423,20136.119999999988
PLASTERS IN TIN STRONGMAN,PLASTERS IN TIN VINTAGE PAISLEY ,PLASTERS IN TIN WOODLAND ANIMALS,POSTAGE,447,19918.04000000002
JUMBO STORAGE BAG SKULLS,JUMBO STORAGE BAG SUKI,LUNCH BAG  BLACK SKULL.,LUNCH BAG RED RETROSPOT,529,19787.740000000013
SET OF 12 FAIRY CAKE BAKING CASES,SET OF 12 MINI LOAF BAKING CASES,SET OF 6 SNACK LOAF BAKING CASES,SET OF 6 TEA TIME BAKING CASES,663,19776.479999999996
LONDON BUS COFFEE MUG,QUEENS GUARD COFFEE MUG,PACK OF 12 LONDON TISSUES ,LUNCH BOX I LOVE LONDON,293,19668.210000000006
RED RETROSPOT CHARLOTTE BAG,WOODLAND CHARLOTTE BAG,WHITE HANGING HEART T-LIGHT HOLDER,STRAWBERRY CHARLOTTE BAG,705,19530.089999999997
CHILDS BREAKFAST SET DOLLY GIRL ,CHILDS BREAKFAST SET SPACEBOY ,DOLLY GIRL LUNCH BOX,SPACEBOY LUNCH BOX ,217,19399.950000000004
PACK OF 60 PINK PAISLEY CAKE CASES,PACK OF 72 RETROSPOT CAKE CASES,PACK OF 72 SKULL CAKE CASES,PACK OF 60 SPACEBOY CAKE CASES,641,19356.149999999958
LUNCH BAG DOILEY PATTERN ,LUNCH BAG SUKI DESIGN ,LUNCH BAG RED RETROSPOT,LUNCH BAG VINTAGE LEAF DESIGN,463,19224.95
JUMBO BAG PAISLEY PARK,LUNCH BAG PAISLEY PARK  ,VINTAGE DOILY JUMBO BAG RED ,JUMBO BAG VINTAGE DOILY ,357,19166.110000000008
IVORY DINER WALL CLOCK,RED DINER WALL CLOCK,REGENCY CAKESTAND 3 TIER,IVORY KITCHEN SCALES,356,19134.9
CANDLEHOLDER PINK HANGING HEART,WHITE HANGING HEART T-LIGHT HOLDER,RED HANGING HEART T-LIGHT HOLDER,HEART OF WICKER SMALL,478,19114.349999999988
BLUE SPOT CERAMIC DRAWER KNOB,BLUE STRIPE CERAMIC DRAWER KNOB,RED SPOT CERAMIC DRAWER KNOB,RED STRIPE CERAMIC DRAWER KNOB,515,19079.16000000001
BLUE STRIPE CERAMIC DRAWER KNOB,RED SPOT CERAMIC DRAWER KNOB,WHITE SPOT RED CERAMIC DRAWER KNOB,RED STRIPE CERAMIC DRAWER KNOB,539,18988.730000000014
RED KITCHEN SCALES,REGENCY CAKESTAND 3 TIER,WHITE HANGING HEART T-LIGHT HOLDER,SET OF 3 CAKE TINS PANTRY DESIGN ,269,18959.969999999994
JUMBO BAG DOLLY GIRL DESIGN,JUMBO BAG RED RETROSPOT,JUMBO BAG SPACEBOY DESIGN,JUMBO STORAGE BAG SUKI,444,18871.30000000001
BLUE VINTAGE SPOT BEAKER,GREEN VINTAGE SPOT BEAKER,PINK VINTAGE SPOT BEAKER,RED VINTAGE SPOT BEAKER,323,18752.120000000003
PANTRY WASHING UP BRUSH,REGENCY CAKESTAND 3 TIER,SET OF 3 CAKE TINS PANTRY DESIGN ,SET OF 4 PANTRY JELLY MOULDS,256,18736.530000000002
DOORMAT UNION FLAG,REGENCY CAKESTAND 3 TIER,JUMBO BAG RED RETROSPOT,WHITE HANGING HEART T-LIGHT HOLDER,250,18720.499999999996
CREAM HEART CARD HOLDER,NATURAL SLATE HEART CHALKBOARD ,WHITE HANGING HEART T-LIGHT HOLDER,WOODEN PICTURE FRAME WHITE FINISH,334,18690.72
ANTIQUE SILVER T-LIGHT GLASS,ASSORTED COLOUR BIRD ORNAMENT,VICTORIAN GLASS HANGING T-LIGHT,ANTIQUE SILVER TEA GLASS ENGRAVED,294,18622.65
STRAWBERRY CERAMIC TRINKET BOX,SWEETHEART CERAMIC TRINKET BOX,WHITE HANGING HEART T-LIGHT HOLDER,STRAWBERRY FAIRY CAKE TEAPOT,386,18426.659999999996
SET/20 RED RETROSPOT PAPER NAPKINS ,SET/6 RED SPOTTY PAPER CUPS,SET/6 RED SPOTTY PAPER PLATES,WHITE HANGING HEART T-LIGHT HOLDER,536,18404.559999999994
BREAD BIN DINER STYLE RED ,REGENCY CAKESTAND 3 TIER,RED KITCHEN SCALES,IVORY KITCHEN SCALES,181,18032.399999999998
GREY HEART HOT WATER BOTTLE,SCOTTIE DOG HOT WATER BOTTLE,RETROSPOT HEART HOT WATER BOTTLE,WHITE HANGING HEART T-LIGHT HOLDER,400,17991.139999999992
FELTCRAFT CUSHION RABBIT,PINK CREAM FELT CRAFT TRINKET BOX ,PINK BLUE FELT CRAFT TRINKET BOX,RED FLORAL FELTCRAFT SHOULDER BAG,227,17973.06
BLUE HARMONICA IN BOX ,RED  HARMONICA IN BOX ,WOODEN BOX OF DOMINOES,VINTAGE SNAP CARDS,494,17789.929999999997
HOT WATER BOTTLE TEA AND SYMPATHY,SCOTTIE DOG HOT WATER BOTTLE,RETROSPOT HEART HOT WATER BOTTLE,LOVE HOT WATER BOTTLE,376,17712.619999999988
CHARLOTTE BAG PINK POLKADOT,CHARLOTTE BAG SUKI DESIGN,RED RETROSPOT CHARLOTTE BAG,STRAWBERRY CHARLOTTE BAG,758,17678.65
CHARLOTTE BAG APPLES DESIGN,LUNCH BAG APPLE DESIGN,CHARLOTTE BAG SUKI DESIGN,RED RETROSPOT CHARLOTTE BAG,572,17676.750000000007
CHARLOTTE BAG SUKI DESIGN,RED RETROSPOT CHARLOTTE BAG,STRAWBERRY CHARLOTTE BAG,WOODLAND CHARLOTTE BAG,774,17643.179999999997
72 SWEETHEART FAIRY CAKE CASES,PACK OF 60 DINOSAUR CAKE CASES,PACK OF 72 RETROSPOT CAKE CASES,PACK OF 60 PINK PAISLEY CAKE CASES,602,17629.289999999994
BLUE 3 PIECE POLKADOT CUTLERY SET,RED 3 PIECE RETROSPOT CUTLERY SET,PINK 3 PIECE POLKADOT CUTLERY SET,GREEN 3 PIECE POLKADOT CUTLERY SET,180,17588.76
VICTORIAN GLASS HANGING T-LIGHT,WHITE HANGING HEART T-LIGHT HOLDER,WOODEN FRAME ANTIQUE WHITE ,WOODEN PICTURE FRAME WHITE FINISH,352,17441.370000000003
SET 2 PANTRY DESIGN TEA TOWELS,SET OF 6 SPICE TINS PANTRY DESIGN,SET OF 3 CAKE TINS PANTRY DESIGN ,SET OF 4 PANTRY JELLY MOULDS,269,17206.92
MINI LIGHTS WOODLAND MUSHROOMS,RED TOADSTOOL LED NIGHT LIGHT,POSTAGE,RABBIT NIGHT LIGHT,184,17187.509999999995
PACK OF 60 DINOSAUR CAKE CASES,PACK OF 60 PINK PAISLEY CAKE CASES,PACK OF 72 RETROSPOT CAKE CASES,PACK OF 60 SPACEBOY CAKE CASES,656,17110.25999999998
COFFEE MUG APPLES DESIGN,COFFEE MUG PEARS  DESIGN,POSTAGE,SET OF 2 TEA TOWELS APPLE AND PEARS,254,17009.930000000015
3 DRAWER ANTIQUE WHITE WOOD CABINET,WOOD 2 DRAWER CABINET WHITE FINISH,WOODEN FRAME ANTIQUE WHITE ,WOODEN PICTURE FRAME WHITE FINISH,231,16992.230000000003
HANGING HEART ZINC T-LIGHT HOLDER,WHITE HANGING HEART T-LIGHT HOLDER,SINGLE HEART ZINC T-LIGHT HOLDER,NATURAL SLATE HEART CHALKBOARD ,380,16805.629999999997
LANDMARK FRAME LONDON BRIDGE ,LANDMARK FRAME OXFORD STREET,LANDMARK FRAME NOTTING HILL ,TRADITIONAL PICK UP STICKS GAME ,60,16770.1
HOT BATHS METAL SIGN,PLEASE ONE PERSON METAL SIGN,WHITE HANGING HEART T-LIGHT HOLDER,LADIES & GENTLEMEN METAL SIGN,312,16716.739999999998
COLOUR GLASS T-LIGHT HOLDER HANGING,VICTORIAN GLASS HANGING T-LIGHT,PARTY BUNTING,WHITE HANGING HEART T-LIGHT HOLDER,332,16715.440000000006
CHOCOLATE THIS WAY METAL SIGN,COOK WITH WINE METAL SIGN ,GIN + TONIC DIET METAL SIGN,HAND OVER THE CHOCOLATE   SIGN ,450,16698.09
CREAM SWEETHEART MINI CHEST,WHITE HANGING HEART T-LIGHT HOLDER,WOODEN PICTURE FRAME WHITE FINISH,NATURAL SLATE HEART CHALKBOARD ,272,16673.84999999999
LOVE BUILDING BLOCK WORD,REGENCY CAKESTAND 3 TIER,WHITE HANGING HEART T-LIGHT HOLDER,WOODEN PICTURE FRAME WHITE FINISH,351,16658.040000000005
RED SPOT CERAMIC DRAWER KNOB,WHITE SPOT BLUE CERAMIC DRAWER KNOB,WHITE SPOT RED CERAMIC DRAWER KNOB,RED STRIPE CERAMIC DRAWER KNOB,478,16642.890000000014
LARGE WHITE HEART OF WICKER,SMALL WHITE HEART OF WICKER,WHITE HANGING HEART T-LIGHT HOLDER,WHITE WICKER STAR ,567,16564.700000000004
NO SINGING METAL SIGN,PLEASE ONE PERSON METAL SIGN,WHITE HANGING HEART T-LIGHT HOLDER,YOU'RE CONFUSING ME METAL SIGN ,309,16532.019999999997
SET 40 HEART SHAPE PETIT FOUR CASES,SET OF 12 FAIRY CAKE BAKING CASES,SET OF 12 MINI LOAF BAKING CASES,SET OF 6 TEA TIME BAKING CASES,201,16431.529999999995
CHILDRENS CUTLERY DOLLY GIRL ,CHILDRENS CUTLERY POLKADOT PINK,CHILDRENS CUTLERY SPACEBOY ,LUNCH BAG SPACEBOY DESIGN ,339,16393.1
HANGING JAM JAR T-LIGHT HOLDER,REGENCY CAKESTAND 3 TIER,VICTORIAN GLASS HANGING T-LIGHT,PARTY BUNTING,162,16337.349999999999
LADIES & GENTLEMEN METAL SIGN,WHITE HANGING HEART T-LIGHT HOLDER,NO SINGING METAL SIGN,PLEASE ONE PERSON METAL SIGN,345,16301.720000000001
HAND WARMER RED LOVE HEART,HAND WARMER RED RETROSPOT,HAND WARMER UNION JACK,HAND WARMER SCOTTY DOG DESIGN,497,16197.899999999998
PANTRY ROLLING PIN,PANTRY SCRUBBING BRUSH,SET OF 4 PANTRY JELLY MOULDS,PANTRY WASHING UP BRUSH,208,16189.56
LOVE HOT WATER BOTTLE,RETROSPOT HEART HOT WATER BOTTLE,SCOTTIE DOG HOT WATER BOTTLE,PAPER CHAIN KIT 50'S CHRISTMAS ,345,16136.55
PAPER CHAIN KIT EMPIRE,PAPER CHAIN KIT RETROSPOT,WOODEN UNION JACK BUNTING,PARTY BUNTING,237,16119.600000000002
FELTCRAFT DOLL MOLLY,FELTCRAFT DOLL ROSIE,FELTCRAFT PRINCESS CHARLOTTE DOLL,FELTCRAFT PRINCESS LOLA DOLL,328,16058.239999999983
JUMBO BAG VINTAGE CHRISTMAS ,JUMBO BAG VINTAGE LEAF,PAPER CHAIN KIT 50'S CHRISTMAS ,JUMBO BAG VINTAGE DOILY ,308,15991.639999999998
LAUNDRY 15C METAL SIGN,TOILET METAL SIGN,WASHROOM METAL SIGN,WHITE HANGING HEART T-LIGHT HOLDER,276,15937.5
