Product_A,Recommendation_1,Recommendation_2,Recommendation_3,Total_CoPurchase_Count,Total_Incremental_Revenue_Potential
CHILDREN'S SPACEBOY MUG,SPACEBOY CHILDRENS EGG CUP,CHILDRENS DOLLY GIRL MUG,SPACEBOY LUNCH BOX ,218,9073.189999999993
DOG BOWL CHASING BALL DESIGN,WHITE HANGING HEART T-LIGHT HOLDER,ILLUSTRATED CAT BOWL ,REGENCY CAKESTAND 3 TIER,93,9069.290000000003
PACK OF 60 SPACEBOY CAKE CASES,PACK OF 72 RETROSPOT CAKE CASES,PACK OF 72 SKULL CAKE CASES,SET OF 60 PANTRY DESIGN CAKE CASES ,472,9040.2
RECYCLED ACAPULCO MAT RED,RECYCLED ACAPULCO MAT TURQUOISE,REGENCY CAKESTAND 3 TIER,SPOTTY BUNTING,161,9038.25
STRAWBERRY CHARLOTTE BAG,STRAWBERRY SHOPPER BAG,WHITE HANGING HEART T-LIGHT HOLDER,WOODLAND CHARLOTTE BAG,367,9032.369999999999
REGENCY CAKE FORK,REGENCY TEA SPOON,REGENCY CAKESTAND 3 TIER,REGENCY TEAPOT ROSES ,116,8990.599999999999
SET OF 20 VINTAGE CHRISTMAS NAPKINS,SET OF 6 RIBBONS VINTAGE CHRISTMAS,VINTAGE CHRISTMAS STOCKING ,VINTAGE CHRISTMAS BUNTING,232,8980.179999999997
MEDIUM CERAMIC TOP STORAGE JAR,SMALL CERAMIC TOP STORAGE JAR ,SET OF 4 PANTRY JELLY MOULDS,SET OF 3 CAKE TINS PANTRY DESIGN ,190,8976.23
DOORMAT WELCOME PUPPIES,REGENCY CAKESTAND 3 TIER,WHITE HANGING HEART T-LIGHT HOLDER,DOORMAT WELCOME TO OUR HOME,136,8965.519999999999
CREAM CUPID HEARTS COAT HANGER,WHITE HANGING HEART T-LIGHT HOLDER,WOODEN FRAME ANTIQUE WHITE ,WOODEN PICTURE FRAME WHITE FINISH,214,8960.1
6 GIFT TAGS 50'S CHRISTMAS ,6 GIFT TAGS VINTAGE CHRISTMAS ,PAPER CHAIN KIT 50'S CHRISTMAS ,ROLL WRAP 50'S CHRISTMAS,342,8936.200000000004
FILIGRIS HEART WITH BUTTERFLY,HEART IVORY TRELLIS SMALL,WHITE HANGING HEART T-LIGHT HOLDER,HEART FILIGREE DOVE  SMALL,177,8930.68
SET/10 RED POLKADOT PARTY CANDLES,SET/20 RED RETROSPOT PAPER NAPKINS ,SET/6 RED SPOTTY PAPER CUPS,SET/6 RED SPOTTY PAPER PLATES,186,8909.579999999998
SET/3 RED GINGHAM ROSE STORAGE BOX,SET3 BOOK BOX GREEN GINGHAM FLOWER ,WHITE HANGING HEART T-LIGHT HOLDER,WOODEN PICTURE FRAME WHITE FINISH,207,8909.31
DINOSAUR LUNCH BOX WITH CUTLERY,SKULL LUNCH BOX WITH CUTLERY ,STRAWBERRY LUNCH BOX WITH CUTLERY,LUNCH BOX WITH CUTLERY RETROSPOT ,238,8901.930000000002
PINK BABY BUNTING,RED BABY BUNTING ,PINK HAPPY BIRTHDAY BUNTING,SPOTTY BUNTING,153,8896.95
BICYCLE SAFTEY WALL ART,DOORMAT KEEP CALM AND COME IN,STOP FOR TEA WALL ART,DOG LICENCE WALL ART,61,8896.619999999999
FELTCRAFT GIRL AMELIE KIT,FELTCRAFT GIRL NICOLE KIT,FELTCRAFT PRINCESS CHARLOTTE DOLL,PINK BLUE FELT CRAFT TRINKET BOX,252,8848.160000000002
RED RETROSPOT WRAP ,REGENCY CAKESTAND 3 TIER,SKULLS AND CROSSBONES WRAP,WRAP ENGLISH ROSE ,155,8840.8
FOOD COVER WITH BEADS SET 2 ,PARTY BUNTING,SPOTTY BUNTING,REGENCY TEA PLATE ROSES ,106,8827.929999999998
BLUE POLKADOT CUP,PINK  POLKADOT CUP,RED RETROSPOT CUP,BLUE POLKADOT PLATE ,360,8827.409999999996
ROLL WRAP 50'S CHRISTMAS,ROLL WRAP 50'S RED CHRISTMAS ,ROLL WRAP VINTAGE SPOT ,ROLL WRAP VINTAGE CHRISTMAS,343,8804.529999999999
"RECORD FRAME 7"" SINGLE SIZE ",SUKI  SHOULDER BAG,WHITE HANGING HEART T-LIGHT HOLDER,VINYL RECORD FRAME SILVER,83,8734.690000000002
RECYCLED ACAPULCO MAT PINK,RECYCLED ACAPULCO MAT RED,RECYCLED ACAPULCO MAT TURQUOISE,REGENCY CAKESTAND 3 TIER,171,8720.8
WOODEN HEART CHRISTMAS SCANDINAVIAN,WOODEN STAR CHRISTMAS SCANDINAVIAN,WOODEN TREE CHRISTMAS SCANDINAVIAN,ZINC FOLKART SLEIGH BELLS,583,8713.630000000008
PAINTED METAL PEARS ASSORTED,WHITE HANGING HEART T-LIGHT HOLDER,WOODEN PICTURE FRAME WHITE FINISH,REGENCY CAKESTAND 3 TIER,177,8711.239999999998
SET/6 RED SPOTTY PAPER CUPS,SET/6 RED SPOTTY PAPER PLATES,SPACEBOY BIRTHDAY CARD,STRAWBERRY LUNCH BOX WITH CUTLERY,301,8695.5
SET OF 20 KIDS COOKIE CUTTERS,SET OF 3 BUTTERFLY COOKIE CUTTERS,SET OF 3 HEART COOKIE CUTTERS,SET OF 4 PANTRY JELLY MOULDS,287,8671.96
HAND WARMER BABUSHKA DESIGN,HAND WARMER BIRD DESIGN,HAND WARMER OWL DESIGN,HAND WARMER SCOTTY DOG DESIGN,296,8655.110000000002
COLOUR GLASS. STAR T-LIGHT HOLDER,WHITE HANGING HEART T-LIGHT HOLDER,RED HANGING HEART T-LIGHT HOLDER,HEART OF WICKER SMALL,145,8649.169999999998
PAPER BUNTING VINTAGE PAISLEY,PAPER CHAIN KIT RETROSPOT,WHITE HANGING HEART T-LIGHT HOLDER,PARTY BUNTING,144,8605.6
PACK OF 12 COLOURED PENCILS,WOODEN SCHOOL COLOURING SET,PACK OF 12 TRADITIONAL CRAYONS,TRADITIONAL MODELLING CLAY,254,8601.660000000003
PHOTO FRAME 3 CLASSIC HANGING,WHITE HANGING HEART T-LIGHT HOLDER,REGENCY CAKESTAND 3 TIER,WOODEN PICTURE FRAME WHITE FINISH,150,8566.75
QUEENS GUARD COFFEE MUG,SOLDIERS EGG CUP ,WHITE HANGING HEART T-LIGHT HOLDER,REGENCY CAKESTAND 3 TIER,153,8477.850000000002
PINK  POLKADOT CUP,RED RETROSPOT CUP,PINK  POLKADOT PLATE ,PINK POLKADOT BOWL,288,8475.43
SILVER HANGING T-LIGHT HOLDER,VICTORIAN GLASS HANGING T-LIGHT,WHITE HANGING HEART T-LIGHT HOLDER,WOODEN PICTURE FRAME WHITE FINISH,175,8460.99
IVORY WICKER HEART LARGE,LARGE WHITE HEART OF WICKER,SMALL WHITE HEART OF WICKER,IVORY WICKER HEART MEDIUM,366,8428.149999999998
3 PIECE SPACEBOY COOKIE CUTTER SET,SET OF 3 BUTTERFLY COOKIE CUTTERS,SET OF 3 HEART COOKIE CUTTERS,GINGERBREAD MAN COOKIE CUTTER,319,8404.429999999997
6 GIFT TAGS VINTAGE CHRISTMAS ,PAPER CHAIN KIT 50'S CHRISTMAS ,ROLL WRAP VINTAGE CHRISTMAS,ROLL WRAP VINTAGE SPOT ,255,8369.94
SET OF 5 LUCKY CAT MAGNETS ,SET OF 5 MINI GROCERY MAGNETS,SET OF 5 PANCAKE DAY MAGNETS,WHITE HANGING HEART T-LIGHT HOLDER,155,8323.340000000002
HANGING METAL HEART LANTERN,NATURAL SLATE HEART CHALKBOARD ,HANGING METAL STAR LANTERN,WHITE HANGING HEART T-LIGHT HOLDER,231,8282.75
STRAWBERRY LUNCH BOX WITH CUTLERY,WOODLAND CHARLOTTE BAG,WOODEN PICTURE FRAME WHITE FINISH,WHITE HANGING HEART T-LIGHT HOLDER,179,8280.270000000004
HOLIDAY FUN LUDO,VINTAGE SNAKES & LADDERS,VINTAGE HEADS AND TAILS CARD GAME ,VINTAGE SNAP CARDS,221,8274.829999999996
VINTAGE CHRISTMAS GIFT SACK,VINTAGE CHRISTMAS STOCKING ,VINTAGE SNAP CARDS,VINTAGE CHRISTMAS TABLECLOTH,137,8266.320000000002
DOLLY GIRL CHILDRENS BOWL,DOLLY GIRL CHILDRENS CUP,SPACEBOY CHILDRENS BOWL,SPACEBOY CHILDRENS CUP,328,8264.95
ROUND CAKE TIN VINTAGE RED,SET/5 RED RETROSPOT LID GLASS BOWLS,WHITE HANGING HEART T-LIGHT HOLDER,SET OF 3 CAKE TINS PANTRY DESIGN ,140,8258.07
FOLDING BUTTERFLY MIRROR RED  ,RABBIT NIGHT LIGHT,ROUND SNACK BOXES SET OF4 WOODLAND ,SPACEBOY LUNCH BOX ,67,8209.89
RECYCLED ACAPULCO MAT LAVENDER,RECYCLED ACAPULCO MAT PINK,RECYCLED ACAPULCO MAT RED,RECYCLED ACAPULCO MAT TURQUOISE,195,8194.1
SET OF 3 HEART COOKIE CUTTERS,WHITE HANGING HEART T-LIGHT HOLDER,SET OF 6 SPICE TINS PANTRY DESIGN,SET OF 4 PANTRY JELLY MOULDS,272,8181.84
TRADITIONAL KNITTING NANCY,TRADITIONAL WOODEN CATCH CUP GAME ,VINTAGE SNAP CARDS,WHITE HANGING HEART T-LIGHT HOLDER,283,8173.33
TEA TIME PARTY BUNTING,WHITE HANGING HEART T-LIGHT HOLDER,WOODEN PICTURE FRAME WHITE FINISH,VINTAGE UNION JACK BUNTING,149,8170.700000000001
ICE CREAM SUNDAE LIP GLOSS,PARTY BUNTING,REGENCY CAKESTAND 3 TIER,JUMBO BAG RED RETROSPOT,90,8147.16
CHRISTMAS LIGHTS 10 VINTAGE BAUBLES,PAPER CHAIN KIT VINTAGE CHRISTMAS,HAND WARMER OWL DESIGN,PAPER CHAIN KIT 50'S CHRISTMAS ,106,8130.19
PARTY METAL SIGN ,REGENCY CAKESTAND 3 TIER,WHITE HANGING HEART T-LIGHT HOLDER,SPOTTY BUNTING,189,8130.05
SPACEBOY MINI BACKPACK,WOODLAND MINI BACKPACK,WHITE HANGING HEART T-LIGHT HOLDER,SPOTTY BUNTING,135,8095.3499999999985
RED RETROSPOT CUP,SET/20 RED RETROSPOT PAPER NAPKINS ,RED RETROSPOT PLATE ,ROUND SNACK BOXES SET OF4 WOODLAND ,225,8087.920000000004
BOX OF 6 CHRISTMAS CAKE DECORATIONS,PAPER CHAIN KIT VINTAGE CHRISTMAS,PAPER CHAIN KIT 50'S CHRISTMAS ,RABBIT NIGHT LIGHT,116,8073.97
SET OF 2 TEA TOWELS APPLE AND PEARS,SPACEBOY LUNCH BOX ,TABLECLOTH RED APPLES DESIGN ,SET OF 4 PANTRY JELLY MOULDS,121,8038.220000000002
WOODEN ROUNDERS GARDEN SET ,WOODEN SCHOOL COLOURING SET,WORLD WAR 2 GLIDERS ASSTD DESIGNS,WOODEN SKITTLES GARDEN SET,129,7971.15
TRIPLE PHOTO FRAME CORNICE ,WHITE HANGING HEART T-LIGHT HOLDER,WOODEN FRAME ANTIQUE WHITE ,WOODEN PICTURE FRAME WHITE FINISH,136,7931.799999999999
DOLLY GIRL CHILDRENS CUP,SPACEBOY CHILDRENS BOWL,SPACEBOY LUNCH BOX ,SPACEBOY CHILDRENS CUP,247,7930.810000000001
BOX OF VINTAGE JIGSAW BLOCKS ,VINTAGE SNAP CARDS,WOODEN BOX OF DOMINOES,RETROSPOT TEA SET CERAMIC 11 PC ,180,7928.120000000001
HEART WREATH DECORATION WITH BELL,STAR WREATH DECORATION WITH BELL,WHITE ROCKING HORSE HAND PAINTED,RED ROCKING HORSE HAND PAINTED,196,7924.110000000001
PINK CREAM FELT CRAFT TRINKET BOX ,WHITE HANGING HEART T-LIGHT HOLDER,RED FLORAL FELTCRAFT SHOULDER BAG,VINTAGE SNAP CARDS,245,7888.700000000002
I'M ON HOLIDAY METAL SIGN,METAL SIGN TAKE IT OR LEAVE IT ,PLEASE ONE PERSON METAL SIGN,POTTERING IN THE SHED METAL SIGN,295,7885.950000000001
PAINT YOUR OWN CANVAS SET,TRADITIONAL MODELLING CLAY,WOODEN SCHOOL COLOURING SET,RED  HARMONICA IN BOX ,128,7879.84
RED RETROSPOT BUTTER DISH,RETROSPOT LARGE MILK JUG,RED RETROSPOT SUGAR JAM BOWL,RED RETROSPOT SMALL MILK JUG,221,7835.250000000002
RETROSPOT CHILDRENS APRON,SET/20 RED RETROSPOT PAPER NAPKINS ,WHITE HANGING HEART T-LIGHT HOLDER,RETROSPOT TEA SET CERAMIC 11 PC ,154,7829.69
PINK DRAWER KNOB ACRYLIC EDWARDIAN,RED STRIPE CERAMIC DRAWER KNOB,PURPLE DRAWERKNOB ACRYLIC EDWARDIAN,WHITE SPOT BLUE CERAMIC DRAWER KNOB,182,7786.550000000001
SET OF 72 RETROSPOT PAPER  DOILIES,SET/20 RED RETROSPOT PAPER NAPKINS ,SET/5 RED RETROSPOT LID GLASS BOWLS,WHITE HANGING HEART T-LIGHT HOLDER,197,7779.949999999997
BINGO SET,VINTAGE SNAKES & LADDERS,WOODEN BOX OF DOMINOES,VINTAGE SNAP CARDS,251,7775.98
GYMKHANA TREASURE BOOK BOX,REGENCY CAKESTAND 3 TIER,TREASURE ISLAND BOOK BOX,TREASURE TIN GYMKHANA DESIGN,150,7734.84
SPACEBOY CHILDRENS BOWL,SPACEBOY CHILDRENS CUP,SPACEBOY LUNCH BOX ,SPACEBOY MINI BACKPACK,207,7722.950000000001
POPPY'S PLAYHOUSE KITCHEN,POPPY'S PLAYHOUSE LIVINGROOM ,VINTAGE SNAP CARDS,WHITE HANGING HEART T-LIGHT HOLDER,325,7701.229999999986
PACK OF 12 TRADITIONAL CRAYONS,WOODEN SCHOOL COLOURING SET,TRADITIONAL MODELLING CLAY,VINTAGE SNAP CARDS,259,7688.170000000001
TOILET METAL SIGN,WHITE HANGING HEART T-LIGHT HOLDER,WASHROOM METAL SIGN,WOODEN PICTURE FRAME WHITE FINISH,187,7670.369999999999
FOOD CONTAINER SET 3 LOVE HEART ,LARGE HEART MEASURING SPOONS,REGENCY CAKESTAND 3 TIER,SET/5 RED RETROSPOT LID GLASS BOWLS,132,7654.489999999999
RED RETROSPOT PEG BAG,SET/5 RED RETROSPOT LID GLASS BOWLS,WHITE HANGING HEART T-LIGHT HOLDER,SET OF 3 CAKE TINS PANTRY DESIGN ,206,7623.829999999999
ANTIQUE GLASS PEDESTAL BOWL,ANTIQUE TALL SWIRLGLASS TRINKET POT,REGENCY CAKESTAND 3 TIER,WHITE HANGING HEART T-LIGHT HOLDER,129,7601.299999999999
DOORMAT UNION JACK GUNS AND ROSES,JUMBO BAG RED RETROSPOT,REGENCY CAKESTAND 3 TIER,WHITE HANGING HEART T-LIGHT HOLDER,93,7570.41
LARGE IVORY HEART WALL ORGANISER,SMALL IVORY HEART WALL ORGANISER,REGENCY CAKESTAND 3 TIER,WHITE HANGING HEART T-LIGHT HOLDER,117,7555.5
VINTAGE SNAKES & LADDERS,VINTAGE SNAP CARDS,WOODEN SCHOOL COLOURING SET,WOODEN BOX OF DOMINOES,214,7536.469999999996
PINK PARTY BAGS,RETROSPOT PARTY BAG + STICKER SET,SET/20 RED RETROSPOT PAPER NAPKINS ,TEA TIME PARTY BUNTING,86,7502.64
DOORMAT AIRMAIL ,DOORMAT RED RETROSPOT,DOORMAT FANCY FONT HOME SWEET HOME,DOORMAT UNION FLAG,105,7483.45
BLUE POLKADOT WRAP,PINK POLKADOT WRAP ,RED RETROSPOT WRAP ,WRAP ENGLISH ROSE ,292,7457.5
BLUE PARTY BAGS ,PINK PARTY BAGS,PAPER BUNTING RETROSPOT,TEA TIME PARTY BUNTING,129,7452.38
PACK OF 12 LONDON TISSUES ,PACK OF 12 SUKI TISSUES ,SOLDIERS EGG CUP ,SET OF 60 I LOVE LONDON CAKE CASES ,184,7440.84
SET OF 6 SOLDIER SKITTLES,TRADITIONAL WOODEN SKIPPING ROPE,VINTAGE SNAP CARDS,TRADITIONAL KNITTING NANCY,217,7405.560000000001
PICTURE FRAME WOOD TRIPLE PORTRAIT,WOODEN FRAME ANTIQUE WHITE ,WOODEN PICTURE FRAME WHITE FINISH,WHITE HANGING HEART T-LIGHT HOLDER,179,7402.45
DECORATIVE WICKER HEART LARGE,IVORY WICKER HEART LARGE,LARGE WHITE HEART OF WICKER,DECORATIVE WICKER HEART MEDIUM,298,7389.789999999997
WALL ART DOG LICENCE ,WALL ART VILLAGE SHOW ,WALL ART STOP FOR TEA ,WALL ART KEEP CALM ,53,7330.0
GRAND CHOCOLATECANDLE,HOMEMADE JAM SCENTED CANDLES,REGENCY CAKESTAND 3 TIER,WHITE HANGING HEART T-LIGHT HOLDER,137,7304.500000000001
OPEN CLOSED METAL SIGN,PARTY METAL SIGN ,WHITE HANGING HEART T-LIGHT HOLDER,REGENCY CAKESTAND 3 TIER,160,7297.659999999998
CUPCAKE LACE PAPER SET 6,JAM MAKING SET WITH JARS,REGENCY CAKESTAND 3 TIER,PARTY BUNTING,102,7279.310000000001
PINK FLORAL FELTCRAFT SHOULDER BAG,RED FLORAL FELTCRAFT SHOULDER BAG,WHITE HANGING HEART T-LIGHT HOLDER,RECIPE BOX PANTRY YELLOW DESIGN,204,7265.42
PACK OF 60 MUSHROOM CAKE CASES,PACK OF 60 PINK PAISLEY CAKE CASES,PACK OF 72 RETROSPOT CAKE CASES,PACK OF 60 SPACEBOY CAKE CASES,387,7239.710000000001
PICTURE DOMINOES,VINTAGE SNAP CARDS,WOODEN BOX OF DOMINOES,VINTAGE HEADS AND TAILS CARD GAME ,285,7221.090000000001
BOYS VINTAGE TIN SEASIDE BUCKET,GIRLS VINTAGE TIN SEASIDE BUCKET,RED METAL BEACH SPADE ,PACK OF 6 SANDCASTLE FLAGS ASSORTED,173,7201.570000000004
REVOLVER WOODEN RULER ,WORLD WAR 2 GLIDERS ASSTD DESIGNS,SET OF 4 PANTRY JELLY MOULDS,WOODEN SCHOOL COLOURING SET,116,7194.649999999999
SET OF 4 KNICK KNACK TINS LONDON ,SET OF 60 I LOVE LONDON CAKE CASES ,TREASURE TIN GYMKHANA DESIGN,TRAVEL CARD WALLET I LOVE LONDON,135,7180.26
MINT DINER WALL CLOCK,PINK DINER WALL CLOCK,RED DINER WALL CLOCK,REGENCY CAKESTAND 3 TIER,140,7169.200000000001
PIGGY BANK RETROSPOT ,RETROSPOT TEA SET CERAMIC 11 PC ,WHITE HANGING HEART T-LIGHT HOLDER,REGENCY CAKESTAND 3 TIER,127,7148.4
CERAMIC CAKE STAND + HANGING CAKES,MINI CAKE STAND WITH HANGING CAKES,LARGE CAKE STAND  HANGING STRAWBERY,WHITE HANGING HEART T-LIGHT HOLDER,129,7142.01
SET OF 36 DOILIES PANTRY DESIGN,SET OF 60 PANTRY DESIGN CAKE CASES ,SPOTTY BUNTING,SET OF 6 TEA TIME BAKING CASES,192,7135.659999999998
WALL ART BICYCLE SAFETY,WALL ART CLASSIC PUDDINGS ,WALL ART DOG LICENCE ,WALL ART STOP FOR TEA ,108,7115.67
TRADITIONAL WOODEN CATCH CUP GAME ,TRADITIONAL WOODEN SKIPPING ROPE,VINTAGE HEADS AND TAILS CARD GAME ,VINTAGE SNAP CARDS,257,7105.870000000004
SET OF 6 SNACK LOAF BAKING CASES,SET OF 6 TEA TIME BAKING CASES,SET OF 60 I LOVE LONDON CAKE CASES ,SET OF 60 PANTRY DESIGN CAKE CASES ,277,7074.930000000002
CLASSIC BICYCLE CLIPS ,CLASSIC CHROME BICYCLE BELL ,RABBIT NIGHT LIGHT,TRADITIONAL PICK UP STICKS GAME ,97,7043.17
CHILDRENS APRON APPLES DESIGN,CHILDRENS APRON SPACEBOY DESIGN,PINK FAIRY CAKE CHILDRENS APRON,RETROSPOT CHILDRENS APRON,255,7011.490000000001
ROUND SNACK BOXES SET OF 4 SKULLS,ROUND SNACK BOXES SET OF4 WOODLAND ,SPACEBOY LUNCH BOX ,WHITE HANGING HEART T-LIGHT HOLDER,177,7007.100000000004
SET OF 3 WOODEN SLEIGH DECORATIONS,SET OF 3 WOODEN STOCKING DECORATION,SET OF 3 WOODEN TREE DECORATIONS,WOODEN STAR CHRISTMAS SCANDINAVIAN,398,7004.44
SMALL GLASS HEART TRINKET POT,WHITE HANGING HEART T-LIGHT HOLDER,WOODEN PICTURE FRAME WHITE FINISH,VICTORIAN GLASS HANGING T-LIGHT,172,7002.099999999999
GREEN METAL BOX ARMY SUPPLIES,RED METAL BOX TOP SECRET,SPOTTY BUNTING,JUMBO BAG RED RETROSPOT,104,6999.070000000001
AGED GLASS SILVER T-LIGHT HOLDER,WHITE HANGING HEART T-LIGHT HOLDER,ASSORTED COLOUR BIRD ORNAMENT,ANTIQUE SILVER T-LIGHT GLASS,147,6990.58
CHRISTMAS LIGHTS 10 SANTAS ,PAPER CHAIN KIT 50'S CHRISTMAS ,PAPER CHAIN KIT VINTAGE CHRISTMAS,CHRISTMAS LIGHTS 10 VINTAGE BAUBLES,92,6968.299999999999
ROLL WRAP VINTAGE CHRISTMAS,ROLL WRAP VINTAGE SPOT ,SET OF 6 RIBBONS VINTAGE CHRISTMAS,SET OF 20 VINTAGE CHRISTMAS NAPKINS,234,6958.459999999999
FELTCRAFT PRINCESS OLIVIA DOLL,PINK BLUE FELT CRAFT TRINKET BOX,PINK CREAM FELT CRAFT TRINKET BOX ,RED FLORAL FELTCRAFT SHOULDER BAG,195,6920.380000000001
HEART IVORY TRELLIS SMALL,HEART OF WICKER SMALL,IVORY HANGING DECORATION  HEART,WHITE HANGING HEART T-LIGHT HOLDER,163,6915.65
SMALL POPCORN HOLDER,WHITE HANGING HEART T-LIGHT HOLDER,STRAWBERRY CHARLOTTE BAG,SPACEBOY LUNCH BOX ,160,6865.990000000001
ADVENT CALENDAR GINGHAM SACK,PAPER CHAIN KIT 50'S CHRISTMAS ,PAPER CHAIN KIT VINTAGE CHRISTMAS,CHRISTMAS CRAFT LITTLE FRIENDS,107,6847.310000000001
DRAWER KNOB CRACKLE GLAZE GREEN,DRAWER KNOB CRACKLE GLAZE IVORY,DRAWER KNOB CRACKLE GLAZE PINK,SPOTTY BUNTING,193,6834.149999999999
SINGLE ANTIQUE ROSE HOOK IVORY,TRIPLE HOOK ANTIQUE IVORY ROSE,WHITE HANGING HEART T-LIGHT HOLDER,SPOTTY BUNTING,226,6829.66
SET OF 5 MINI GROCERY MAGNETS,SET OF 5 PANCAKE DAY MAGNETS,WHITE HANGING HEART T-LIGHT HOLDER,SPOTTY BUNTING,168,6813.500000000002
WHITE SPOT BLUE CERAMIC DRAWER KNOB,WHITE SPOT RED CERAMIC DRAWER KNOB,WOODEN FRAME ANTIQUE WHITE ,WOODEN PICTURE FRAME WHITE FINISH,198,6803.360000000004
WOODEN BOX OF DOMINOES,WORLD WAR 2 GLIDERS ASSTD DESIGNS,WOODEN PICTURE FRAME WHITE FINISH,WOODEN SCHOOL COLOURING SET,207,6789.720000000004
SPACEBOY BEAKER,SPACEBOY CHILDRENS BOWL,SPACEBOY CHILDRENS CUP,SPACEBOY LUNCH BOX ,133,6784.100000000002
T-LIGHT GLASS FLUTED ANTIQUE,VICTORIAN GLASS HANGING T-LIGHT,WHITE HANGING HEART T-LIGHT HOLDER,WOODEN PICTURE FRAME WHITE FINISH,116,6761.629999999999
PICNIC BOXES SET OF 3 RETROSPOT ,ROUND SNACK BOXES SET OF4 WOODLAND ,ROUND SNACK BOXES SET OF 4 FRUITS ,ROUND CONTAINER SET OF 5 RETROSPOT,115,6760.449999999999
PINK FAIRY CAKE CHILDRENS APRON,RETROSPOT CHILDRENS APRON,WHITE HANGING HEART T-LIGHT HOLDER,SET OF 4 PANTRY JELLY MOULDS,235,6752.779999999998
CHRISTMAS METAL TAGS ASSORTED ,PAPER CHAIN KIT 50'S CHRISTMAS ,PAPER CHAIN KIT VINTAGE CHRISTMAS,SET OF 20 VINTAGE CHRISTMAS NAPKINS,109,6750.850000000001
RED RETROSPOT OVEN GLOVE ,SET/5 RED RETROSPOT LID GLASS BOWLS,SET/2 RED RETROSPOT TEA TOWELS ,TEA TIME OVEN GLOVE,209,6748.290000000001
LARGE CAKE STAND  HANGING STRAWBERY,REGENCY CAKESTAND 3 TIER,WHITE HANGING HEART T-LIGHT HOLDER,MINI CAKE STAND  HANGING STRAWBERY,100,6735.2
PICNIC BASKET WICKER SMALL,WHITE HANGING HEART T-LIGHT HOLDER,RECIPE BOX PANTRY YELLOW DESIGN,REGENCY CAKESTAND 3 TIER,90,6734.650000000001
MULTI COLOUR SILVER T-LIGHT HOLDER,REGENCY CAKESTAND 3 TIER,WHITE HANGING HEART T-LIGHT HOLDER,VICTORIAN GLASS HANGING T-LIGHT,124,6732.639999999999
RECIPE BOX BLUE SKETCHBOOK DESIGN,RECIPE BOX PANTRY YELLOW DESIGN,RECIPE BOX RETROSPOT ,WHITE HANGING HEART T-LIGHT HOLDER,246,6718.260000000006
LARGE HEART MEASURING SPOONS,SMALL HEART MEASURING SPOONS,REGENCY CAKESTAND 3 TIER,SET OF 3 HEART COOKIE CUTTERS,229,6717.469999999999
SET OF 6 RIBBONS VINTAGE CHRISTMAS,TRADITIONAL CHRISTMAS RIBBONS,VINTAGE CHRISTMAS BUNTING,VINTAGE CHRISTMAS STOCKING ,158,6711.22
COFFEE MUG PEARS  DESIGN,POSTAGE,SET OF 2 TEA TOWELS APPLE AND PEARS,PACK OF 20 NAPKINS RED APPLES,105,6697.3
SET OF 6 TEA TIME BAKING CASES,SET OF 60 PANTRY DESIGN CAKE CASES ,SET OF 60 VINTAGE LEAF CAKE CASES ,SPOTTY BUNTING,163,6654.810000000001
SET OF 3 CAKE TINS SKETCHBOOK,WHITE HANGING HEART T-LIGHT HOLDER,SET OF 6 HERB TINS SKETCHBOOK,SET OF 6 SPICE TINS PANTRY DESIGN,173,6641.9000000000015
PEG BAG APPLES DESIGN,RED RETROSPOT PEG BAG,WHITE HANGING HEART T-LIGHT HOLDER,SET OF 2 TEA TOWELS APPLE AND PEARS,180,6615.799999999997
PANTRY MAGNETIC  SHOPPING LIST,SET OF 3 CAKE TINS PANTRY DESIGN ,SKETCHBOOK MAGNETIC SHOPPING LIST,RECIPE BOX PANTRY YELLOW DESIGN,291,6615.549999999997
VINTAGE DONKEY TAIL GAME ,VINTAGE SNAP CARDS,VINTAGE SNAKES & LADDERS,VINTAGE HEADS AND TAILS CARD GAME ,152,6586.839999999998
FANCY FONTS BIRTHDAY WRAP,RED RETROSPOT WRAP ,REGENCY CAKESTAND 3 TIER,WRAP ENGLISH ROSE ,132,6568.349999999999
LARGE DECO JEWELLERY STAND,WHITE HANGING HEART T-LIGHT HOLDER,PARTY BUNTING,SMALL DECO JEWELLERY STAND,76,6564.400000000001
RED RETROSPOT TRADITIONAL TEAPOT ,RETROSPOT LARGE MILK JUG,REGENCY CAKESTAND 3 TIER,WHITE HANGING HEART T-LIGHT HOLDER,99,6552.550000000001
NOVELTY BISCUITS CAKE STAND 3 TIER,REGENCY CAKESTAND 3 TIER,WHITE HANGING HEART T-LIGHT HOLDER,SET OF 3 CAKE TINS PANTRY DESIGN ,103,6546.49
TREASURE TIN BUFFALO BILL ,TREASURE TIN GYMKHANA DESIGN,VINTAGE SNAP CARDS,WHITE HANGING HEART T-LIGHT HOLDER,187,6516.490000000002
HERB MARKER BASIL,HERB MARKER PARSLEY,HERB MARKER ROSEMARY,HERB MARKER THYME,511,6491.849999999991
PACK OF SIX LED TEA LIGHTS,SET 6 PAPER TABLE LANTERN STARS ,PAPER CHAIN KIT 50'S CHRISTMAS ,PAPER CHAIN KIT VINTAGE CHRISTMAS,105,6485.990000000001
BELLE JARDINIERE CUSHION COVER,HOME SWEET HOME CUSHION COVER ,POSTE FRANCE CUSHION COVER,LE JARDIN BOTANIQUE CUSHION COVER,221,6478.4400000000005
BLUE DRAWER KNOB ACRYLIC EDWARDIAN,CLEAR DRAWER KNOB ACRYLIC EDWARDIAN,PINK DRAWER KNOB ACRYLIC EDWARDIAN,PURPLE DRAWERKNOB ACRYLIC EDWARDIAN,181,6478.43
WALL ART CLASSIC PUDDINGS ,WALL ART STOP FOR TEA ,WALL ART VILLAGE SHOW ,WALL ART ONLY ONE PERSON ,92,6475.419999999999
DRAWER KNOB CRACKLE GLAZE BLUE,DRAWER KNOB CRACKLE GLAZE GREEN,DRAWER KNOB CRACKLE GLAZE IVORY,DRAWER KNOB CRACKLE GLAZE PINK,205,6471.149999999997
GLASS APOTHECARY BOTTLE TONIC,REGENCY CAKESTAND 3 TIER,SET OF 3 REGENCY CAKE TINS,PAPER CHAIN KIT 50'S CHRISTMAS ,91,6448.29
RED METAL BOX TOP SECRET,SPOTTY BUNTING,REGENCY CAKESTAND 3 TIER,RETROSPOT TEA SET CERAMIC 11 PC ,87,6426.569999999999
SWEETHEART CERAMIC TRINKET BOX,TEA TIME OVEN GLOVE,WHITE HANGING HEART T-LIGHT HOLDER,WOODEN PICTURE FRAME WHITE FINISH,173,6374.100000000001
SWEETHEART RECIPE BOOK STAND,WOOD BLACK BOARD ANT WHITE FINISH,WHITE HANGING HEART T-LIGHT HOLDER,WOODEN FRAME ANTIQUE WHITE ,140,6365.6500000000015
BAG 250g SWIRLY MARBLES,WOODEN BOX OF DOMINOES,VINTAGE SNAP CARDS,RED  HARMONICA IN BOX ,151,6358.709999999998
JUMBO BAG SCANDINAVIAN PAISLEY,JUMBO BAG STRAWBERRY,JUMBO SHOPPER VINTAGE RED PAISLEY,JUMBO STORAGE BAG SUKI,99,6349.5
CLASSIC GLASS COOKIE JAR,REGENCY CAKESTAND 3 TIER,SPOTTY BUNTING,SET OF 3 REGENCY CAKE TINS,110,6345.950000000001
FRYING PAN UNION FLAG,JUMBO BAG RED RETROSPOT,PACK OF 72 RETROSPOT CAKE CASES,SET/5 RED RETROSPOT LID GLASS BOWLS,71,6338.45
SCANDINAVIAN REDS RIBBONS,WHITE HANGING HEART T-LIGHT HOLDER,TRADITIONAL CHRISTMAS RIBBONS,SET OF 6 RIBBONS VINTAGE CHRISTMAS,222,6327.4800000000005
JINGLE BELL HEART ANTIQUE SILVER,PAPER CHAIN KIT 50'S CHRISTMAS ,PAPER CHAIN KIT VINTAGE CHRISTMAS,ZINC FOLKART SLEIGH BELLS,131,6325.699999999999
RED RETROSPOT SHOPPER BAG,STRAWBERRY SHOPPER BAG,WHITE HANGING HEART T-LIGHT HOLDER,STRAWBERRY CHARLOTTE BAG,256,6322.53
36 PENCILS TUBE RED RETROSPOT,36 PENCILS TUBE WOODLAND,36 PENCILS TUBE SKULLS,LUNCH BAG RED RETROSPOT,180,6311.980000000001
"SET 3 RETROSPOT TEA,COFFEE,SUGAR",SET/5 RED RETROSPOT LID GLASS BOWLS,WHITE HANGING HEART T-LIGHT HOLDER,SET OF 3 CAKE TINS PANTRY DESIGN ,151,6295.740000000001
POTTING SHED TEA MUG,REGENCY CAKESTAND 3 TIER,WHITE HANGING HEART T-LIGHT HOLDER,SET OF 3 CAKE TINS PANTRY DESIGN ,142,6263.379999999999
PURPLE DRAWERKNOB ACRYLIC EDWARDIAN,RED DRAWER KNOB ACRYLIC EDWARDIAN,WHITE SPOT BLUE CERAMIC DRAWER KNOB,WHITE SPOT RED CERAMIC DRAWER KNOB,154,6238.800000000001
FAIRY TALE COTTAGE NIGHT LIGHT,PAPER CHAIN KIT 50'S CHRISTMAS ,RED TOADSTOOL LED NIGHT LIGHT,RABBIT NIGHT LIGHT,87,6219.050000000001
GIRLS VINTAGE TIN SEASIDE BUCKET,RED METAL BEACH SPADE ,SPACEBOY LUNCH BOX ,REGENCY CAKESTAND 3 TIER,118,6214.700000000001
DOORMAT MERRY CHRISTMAS RED ,PAPER CHAIN KIT 50'S CHRISTMAS ,PAPER CHAIN KIT VINTAGE CHRISTMAS,REGENCY CAKESTAND 3 TIER,90,6199.179999999999
BLUE COAT RACK PARIS FASHION,RED COAT RACK PARIS FASHION,YELLOW COAT RACK PARIS FASHION,REGENCY CAKESTAND 3 TIER,175,6188.910000000002
CAT BOWL VINTAGE CREAM,DOG BOWL VINTAGE CREAM,VINTAGE CREAM CAT FOOD CONTAINER,VINTAGE CREAM DOG FOOD CONTAINER,162,6182.790000000001
FAIRY TALE COTTAGE NIGHTLIGHT,RED TOADSTOOL LED NIGHT LIGHT,POPPY'S PLAYHOUSE KITCHEN,RETROSPOT TEA SET CERAMIC 11 PC ,67,6177.449999999995
SET OF 72 PINK HEART PAPER DOILIES,SET OF 72 RETROSPOT PAPER  DOILIES,SET/20 RED RETROSPOT PAPER NAPKINS ,WHITE HANGING HEART T-LIGHT HOLDER,166,6173.529999999998
BAG 125g SWIRLY MARBLES,VINTAGE SNAP CARDS,WOODEN BOX OF DOMINOES,RED  HARMONICA IN BOX ,164,6169.289999999998
FELTCRAFT BOY JEAN-PAUL KIT,FELTCRAFT GIRL AMELIE KIT,FELTCRAFT GIRL NICOLE KIT,PINK BLUE FELT CRAFT TRINKET BOX,180,6164.92
 50'S CHRISTMAS GIFT BAG LARGE,50'S CHRISTMAS PAPER GIFT BAG,6 GIFT TAGS 50'S CHRISTMAS ,PAPER CHAIN KIT 50'S CHRISTMAS ,161,6162.150000000002
PACK OF 6 PANNETONE GIFT BOXES,REGENCY CAKESTAND 3 TIER,PAPER CHAIN KIT 50'S CHRISTMAS ,PACK OF 6 SWEETIE GIFT BOXES,76,6159.23
BAKING MOULD EASTER EGG MILK CHOC,BAKING MOULD EASTER EGG WHITE CHOC,BAKING MOULD HEART MILK CHOCOLATE,SET OF 3 CAKE TINS PANTRY DESIGN ,90,6153.250000000004
SET 7 BABUSHKA NESTING BOXES,WHITE HANGING HEART T-LIGHT HOLDER,SMALL PURPLE BABUSHKA NOTEBOOK ,SMALL RED BABUSHKA NOTEBOOK ,129,6131.710000000001
BABUSHKA LIGHTS STRING OF 10,SET 10 LIGHTS NIGHT OWL,CHILLI LIGHTS,SET 10 NIGHT OWL LIGHTS,76,6126.95
RIBBON REEL CHRISTMAS SOCK BAUBLE,RIBBON REEL MAKING SNOWMEN ,RIBBON REEL SNOWY VILLAGE,RIBBON REEL SOCKS AND MITTENS,215,6107.809999999998
TRADITIONAL NAUGHTS & CROSSES,WOODEN BOX OF DOMINOES,TRADITIONAL PICK UP STICKS GAME ,TRADTIONAL ALPHABET STAMP SET,217,6080.0
RIBBON REEL SNOWY VILLAGE,SET OF 20 VINTAGE CHRISTMAS NAPKINS,RIBBON REEL SOCKS AND MITTENS,SET OF 6 RIBBONS VINTAGE CHRISTMAS,155,6074.139999999999
SET OF 60 I LOVE LONDON CAKE CASES ,SET OF 60 PANTRY DESIGN CAKE CASES ,SET OF 60 VINTAGE LEAF CAKE CASES ,WHITE HANGING HEART T-LIGHT HOLDER,290,6066.1100000000015
3D TRADITIONAL CHRISTMAS STICKERS,PAPER CHAIN KIT 50'S CHRISTMAS ,PAPER CHAIN KIT VINTAGE CHRISTMAS,3D VINTAGE CHRISTMAS STICKERS ,175,6063.3600000000015
BIRDHOUSE GARDEN MARKER ,DAISY GARDEN MARKER,WATERING CAN GARDEN MARKER,WHITE HANGING HEART T-LIGHT HOLDER,78,6043.049999999999
GREEN POLKADOT BOWL,RED RETROSPOT BOWL,GREEN POLKADOT PLATE ,PINK POLKADOT BOWL,258,6032.74
HOT WATER BOTTLE BABUSHKA ,RETROSPOT HEART HOT WATER BOTTLE,SCOTTIE DOG HOT WATER BOTTLE,WHITE SKULL HOT WATER BOTTLE ,105,6008.949999999999
RED RETROSPOT SUGAR JAM BOWL,SET/5 RED RETROSPOT LID GLASS BOWLS,WHITE HANGING HEART T-LIGHT HOLDER,RETROSPOT LARGE MILK JUG,179,5994.1500000000015
IVORY HANGING DECORATION  HEART,NATURAL SLATE HEART CHALKBOARD ,WHITE HANGING HEART T-LIGHT HOLDER,ZINC METAL HEART DECORATION,175,5983.589999999998
