Product_A,Recommendation_1,Recommendation_2,Recommendation_3,Total_CoPurchase_Count,Total_Incremental_Revenue_Potential
PACK OF 12 VINTAGE CHRISTMAS TISSUE,PAPER CHAIN KIT 50'S CHRISTMAS ,PAPER CHAIN KIT VINTAGE CHRISTMAS,SET OF 20 VINTAGE CHRISTMAS NAPKINS,122,4244.569999999998
STRAWBERRY   PICNIC BAG,WHITE HANGING HEART T-LIGHT HOLDER,STRAWBERRY SHOPPER BAG,STRAWBERRY CHARLOTTE BAG,101,4243.700000000001
MINI WOODEN HAPPY BIRTHDAY GARLAND,WOODEN HAPPY BIRTHDAY GARLAND,PARTY BUNTING,WHITE HANGING HEART T-LIGHT HOLDER,99,4239.709999999999
6 RIBBONS ELEGANT CHRISTMAS ,SCANDINAVIAN REDS RIBBONS,TRADITIONAL CHRISTMAS RIBBONS,PAPER CHAIN KIT 50'S CHRISTMAS ,132,4220.789999999999
JINGLE BELL HEART ANTIQUE GOLD,JINGLE BELL HEART ANTIQUE SILVER,WHITE HANGING HEART T-LIGHT HOLDER,PAPER CHAIN KIT 50'S CHRISTMAS ,91,4209.450000000001
36 DOILIES DOLLY GIRL,60 CAKE CASES DOLLY GIRL DESIGN,PACK OF 60 SPACEBOY CAKE CASES,PACK OF 72 RETROSPOT CAKE CASES,95,4201.149999999998
FLORAL FOLK STATIONERY SET,MODERN FLORAL STATIONERY SET,VINTAGE PAISLEY STATIONERY SET,WHITE HANGING HEART T-LIGHT HOLDER,213,4191.66
VINTAGE DOILY DELUXE SEWING KIT ,VINTAGE DOILY TRAVEL SEWING KIT,WOODEN HEART CHRISTMAS SCANDINAVIAN,WOODEN STAR CHRISTMAS SCANDINAVIAN,118,4180.819999999998
FAIRY CAKE BIRTHDAY CANDLE SET,REGENCY CAKESTAND 3 TIER,POSTAGE,STRAWBERRY CERAMIC TRINKET BOX,64,4169.4
MINI JIGSAW DOLLY GIRL,MINI JIGSAW SPACEBOY,POSTAGE,VINTAGE HEADS AND TAILS CARD GAME ,103,4167.969999999999
TRIPLE HOOK ANTIQUE IVORY ROSE,WHITE HANGING HEART T-LIGHT HOLDER,WOOD BLACK BOARD ANT WHITE FINISH,WOODEN PICTURE FRAME WHITE FINISH,115,4150.07
NOEL WOODEN BLOCK LETTERS ,PEACE WOODEN BLOCK LETTERS,PAPER CHAIN KIT 50'S CHRISTMAS ,WHITE HANGING HEART T-LIGHT HOLDER,95,4144.410000000001
RED GINGHAM ROSE JEWELLERY BOX,SET3 BOOK BOX GREEN GINGHAM FLOWER ,SET/3 RED GINGHAM ROSE STORAGE BOX,WHITE HANGING HEART T-LIGHT HOLDER,114,4140.84
VICTORIAN SEWING BOX LARGE,VICTORIAN SEWING BOX SMALL ,VICTORIAN SEWING BOX MEDIUM,WOOD 2 DRAWER CABINET WHITE FINISH,69,4135.9000000000015
DRAWER KNOB CERAMIC BLACK,DRAWER KNOB CERAMIC IVORY,DRAWER KNOB CRACKLE GLAZE IVORY,RED STRIPE CERAMIC DRAWER KNOB,118,4130.42
CALENDAR PAPER CUT DESIGN,WHITE HANGING HEART T-LIGHT HOLDER,RECIPE BOX PANTRY YELLOW DESIGN,SET OF 3 CAKE TINS PANTRY DESIGN ,126,4122.689999999999
BLUE REFECTORY CLOCK ,IVORY REFECTORY CLOCK,MINT DINER WALL CLOCK,RED REFECTORY CLOCK ,88,4093.7999999999993
6 CHOCOLATE LOVE HEART T-LIGHTS,WHITE HANGING HEART T-LIGHT HOLDER,HEART OF WICKER SMALL,HAND OVER THE CHOCOLATE   SIGN ,81,4088.67
BIG DOUGHNUT FRIDGE MAGNETS,STRAWBERRY CERAMIC TRINKET BOX,POSTAGE,SWEETHEART CERAMIC TRINKET BOX,61,4087.930000000001
HOME SWEET HOME BLACKBOARD,LETTER HOLDER HOME SWEET HOME,SMALL WHITE HEART OF WICKER,HOT WATER BOTTLE KEEP CALM,93,4081.9300000000003
SMALL CERAMIC TOP STORAGE JAR ,WOODLAND CHARLOTTE BAG,SPOTTY BUNTING,WHITE HANGING HEART T-LIGHT HOLDER,79,4065.8299999999995
RED COAT RACK PARIS FASHION,YELLOW COAT RACK PARIS FASHION,WHITE HANGING HEART T-LIGHT HOLDER,REGENCY CAKESTAND 3 TIER,96,4061.830000000001
PLAYING CARDS JUBILEE UNION JACK,PLAYING CARDS KEEP CALM & CARRY ON,VINTAGE SNAP CARDS,PLAYING CARDS VINTAGE DOILY ,180,4047.5
12 MESSAGE CARDS WITH ENVELOPES,WHITE HANGING HEART T-LIGHT HOLDER,PAPER CHAIN KIT 50'S CHRISTMAS ,BLUE HARMONICA IN BOX ,90,4046.2
VINTAGE RED ENAMEL TRIM MUG ,VINTAGE RED ENAMEL TRIM PLATE,VINTAGE RED TRIM ENAMEL BOWL ,WOODEN SCHOOL COLOURING SET,111,4034.7699999999995
DINOSAUR PARTY BAG + STICKER SET,WOODLAND PARTY BAG + STICKER SET,RETROSPOT PARTY BAG + STICKER SET,SKULLS PARTY BAG + STICKER SET,125,4034.0800000000004
EMBROIDERED RIBBON REEL DAISY ,EMBROIDERED RIBBON REEL EMILY ,EMBROIDERED RIBBON REEL SALLY ,EMBROIDERED RIBBON REEL SUSIE ,102,4026.960000000002
BUNDLE OF 3 RETRO NOTE BOOKS,LUNCH BAG APPLE DESIGN,LUNCH BAG VINTAGE LEAF DESIGN,JUMBO BAG VINTAGE LEAF,147,4019.5399999999995
ALPHABET STENCIL CRAFT,HAPPY STENCIL CRAFT,LUNCH BAG SPACEBOY DESIGN ,MONSTERS STENCIL CRAFT,232,4019.1900000000005
MISTLETOE HEART WREATH CREAM,WHITE HANGING HEART T-LIGHT HOLDER,MISTLETOE HEART WREATH GREEN,PAPER CHAIN KIT 50'S CHRISTMAS ,86,4007.8100000000004
PHARMACIE FIRST AID TIN,REGENCY CAKESTAND 3 TIER,SET OF 3 CAKE TINS PANTRY DESIGN ,PLASTERS IN TIN WOODLAND ANIMALS,54,4003.8500000000004
BAKING MOULD CHOCOLATE CUPCAKES,BAKING MOULD HEART MILK CHOCOLATE,BAKING MOULD HEART WHITE CHOCOLATE,SET OF 3 HEART COOKIE CUTTERS,136,4000.32
EASTER TIN BUNNY BOUQUET,EASTER TIN CHICKS PINK DAISY,EASTER TIN KEEPSAKE,SET 3 PAPER VINTAGE CHICK PAPER EGG,144,3999.599999999997
12 PENCILS TALL TUBE RED RETROSPOT,12 PENCILS TALL TUBE SKULLS,12 PENCILS TALL TUBE WOODLAND,WHITE HANGING HEART T-LIGHT HOLDER,225,3996.0199999999995
CARD CHRISTMAS VILLAGE,CARD MOTORBIKE SANTA,PAPER CHAIN KIT 50'S CHRISTMAS ,PAPER CHAIN KIT VINTAGE CHRISTMAS,177,3985.76
EMBROIDERED RIBBON REEL ROSIE,EMBROIDERED RIBBON REEL SALLY ,EMBROIDERED RIBBON REEL SUSIE ,EMBROIDERED RIBBON REEL SOPHIE  ,81,3967.6300000000006
FRENCH BLUE METAL DOOR SIGN 5,FRENCH BLUE METAL DOOR SIGN 8,FRENCH BLUE METAL DOOR SIGN 6,FRENCH BLUE METAL DOOR SIGN 7,166,3951.8600000000006
HEART DECORATION WITH PEARLS ,HEART OF WICKER SMALL,WHITE HANGING HEART T-LIGHT HOLDER,NATURAL SLATE HEART CHALKBOARD ,134,3943.600000000001
SET3 BOOK BOX GREEN GINGHAM FLOWER ,WOOD 2 DRAWER CABINET WHITE FINISH,WHITE HANGING HEART T-LIGHT HOLDER,WOODEN PICTURE FRAME WHITE FINISH,73,3942.8
METAL SIGN DROP YOUR PANTS,PARTY METAL SIGN ,PLEASE ONE PERSON METAL SIGN,PAPER CHAIN KIT 50'S CHRISTMAS ,107,3942.7200000000003
VINTAGE CHRISTMAS GIFT BAG LARGE ,WRAP CHRISTMAS VILLAGE,VINTAGE CHRISTMAS PAPER GIFT BAG,VINTAGE CHRISTMAS STOCKING ,96,3937.2099999999996
CARD DOLLY GIRL ,ROBOT BIRTHDAY CARD,SPACEBOY BIRTHDAY CARD,TEA PARTY BIRTHDAY CARD,239,3929.68
RED FLORAL FELTCRAFT SHOULDER BAG,WHITE HANGING HEART T-LIGHT HOLDER,RETROSPOT TEA SET CERAMIC 11 PC ,TRADITIONAL KNITTING NANCY,113,3927.9699999999993
"FANCY FONT BIRTHDAY CARD, ",FANCY FONTS BIRTHDAY WRAP,SPACEBOY BIRTHDAY CARD,SWALLOWS GREETING CARD,187,3921.48
SMALL RED RETROSPOT MUG IN BOX ,SMALL WHITE RETROSPOT MUG IN BOX ,TEA BAG PLATE RED RETROSPOT,WHITE HANGING HEART T-LIGHT HOLDER,80,3920.4200000000005
FRENCH BLUE METAL DOOR SIGN 3,FRENCH BLUE METAL DOOR SIGN 4,FRENCH BLUE METAL DOOR SIGN 5,FRENCH BLUE METAL DOOR SIGN 7,169,3900.01
SET/3 VANILLA SCENTED CANDLE IN BOX,VANILLA SCENT CANDLE JEWELLED BOX,WOODEN PICTURE FRAME WHITE FINISH,WHITE HANGING HEART T-LIGHT HOLDER,83,3898.310000000001
VANILLA SCENT CANDLE JEWELLED BOX,WHITE HANGING HEART T-LIGHT HOLDER,WOODEN FRAME ANTIQUE WHITE ,WOODEN PICTURE FRAME WHITE FINISH,61,3895.0300000000007
VINTAGE DOILY JUMBO BAG RED ,VINTAGE DOILY TRAVEL SEWING KIT,WHITE HANGING HEART T-LIGHT HOLDER,WOODEN STAR CHRISTMAS SCANDINAVIAN,87,3891.169999999999
FIRST AID TIN,NATURAL SLATE HEART CHALKBOARD ,WHITE HANGING HEART T-LIGHT HOLDER,SET OF 3 CAKE TINS PANTRY DESIGN ,83,3887.35
METAL DECORATION NAUGHTY CHILDREN ,REGENCY CAKESTAND 3 TIER,WHITE HANGING HEART T-LIGHT HOLDER,WOODEN BOX OF DOMINOES,69,3874.49
BOTTLE BAG RETROSPOT ,RECYCLING BAG RETROSPOT ,JUMBO BAG RED RETROSPOT,LUNCH BAG RED RETROSPOT,88,3855.24
SET OF 3 HANGING OWLS OLLIE BEAK,SET OF 3 WOODEN HEART DECORATIONS,SET OF 3 WOODEN SLEIGH DECORATIONS,SET OF 3 WOODEN TREE DECORATIONS,209,3851.27
RIBBON REEL STRIPES DESIGN ,SCANDINAVIAN REDS RIBBONS,TRADITIONAL CHRISTMAS RIBBONS,WHITE HANGING HEART T-LIGHT HOLDER,145,3846.64
FRENCH BLUE METAL DOOR SIGN 4,FRENCH BLUE METAL DOOR SIGN 8,FRENCH BLUE METAL DOOR SIGN 5,FRENCH BLUE METAL DOOR SIGN 6,166,3845.5600000000004
FRENCH BLUE METAL DOOR SIGN 0,FRENCH BLUE METAL DOOR SIGN 1,FRENCH BLUE METAL DOOR SIGN 2,FRENCH BLUE METAL DOOR SIGN 4,169,3845.2
"KEY FOB , SHED",WHITE HANGING HEART T-LIGHT HOLDER,NATURAL SLATE HEART CHALKBOARD ,LUNCH BAG RED RETROSPOT,182,3842.3399999999997
PINK OWL SOFT TOY,WHITE HANGING HEART T-LIGHT HOLDER,REGENCY CAKESTAND 3 TIER,RETROSPOT TEA SET CERAMIC 11 PC ,65,3841.05
GIN AND TONIC DIET METAL SIGN,HAND OVER THE CHOCOLATE   SIGN ,N0 SINGING METAL SIGN,PLEASE ONE PERSON METAL SIGN,52,3822.6299999999997
EMBROIDERED RIBBON REEL EMILY ,EMBROIDERED RIBBON REEL REBECCA ,EMBROIDERED RIBBON REEL SALLY ,EMBROIDERED RIBBON REEL SUSIE ,118,3820.8600000000006
WELCOME  WOODEN BLOCK LETTERS,WHITE HANGING HEART T-LIGHT HOLDER,WOODEN PICTURE FRAME WHITE FINISH,WHITE WOOD GARDEN PLANT LADDER,86,3820.449999999999
SET 36 COLOUR PENCILS DOLLY GIRL,SET 36 COLOUR PENCILS SPACEBOY ,SET 36 COLOUR PENCILS LOVE LONDON,SET 36 COLOURING PENCILS DOILY,127,3819.41
CHRISTMAS TOILET ROLL,PAPER CHAIN KIT VINTAGE CHRISTMAS,REX CASH+CARRY JUMBO SHOPPER,PAPER CHAIN KIT 50'S CHRISTMAS ,135,3818.9400000000005
PLAYING CARDS KEEP CALM & CARRY ON,VINTAGE SNAP CARDS,VINTAGE DOILY TRAVEL SEWING KIT,SCOTTIE DOG HOT WATER BOTTLE,142,3818.000000000001
"KEY FOB , BACK DOOR ","KEY FOB , FRONT  DOOR ","KEY FOB , GARAGE DESIGN","KEY FOB , SHED",352,3815.640000000001
MAGIC DRAWING SLATE SPACEBOY ,PLASTERS IN TIN SPACEBOY,MINI JIGSAW SPACEBOY,MINI PAINT SET VINTAGE ,117,3803.3599999999997
FUNKY WASHING UP GLOVES ASSORTED,RETROSPOT RED WASHING UP GLOVES,WHITE HANGING HEART T-LIGHT HOLDER,REGENCY CAKESTAND 3 TIER,126,3803.1499999999996
COFFEE MUG DOG + BALL DESIGN,WHITE HANGING HEART T-LIGHT HOLDER,COFFEE MUG PEARS  DESIGN,LONDON BUS COFFEE MUG,88,3795.9300000000007
CHOCOLATE BOX RIBBONS ,ROMANTIC PINKS RIBBONS ,SCANDINAVIAN REDS RIBBONS,TRADITIONAL CHRISTMAS RIBBONS,263,3789.34
BAKING MOULD HEART WHITE CHOCOLATE,JAM MAKING SET PRINTED,JAM MAKING SET WITH JARS,SET OF 3 HEART COOKIE CUTTERS,96,3787.8199999999997
HERB MARKER ROSEMARY,HERB MARKER THYME,WHITE HANGING HEART T-LIGHT HOLDER,SET OF 6 SPICE TINS PANTRY DESIGN,251,3779.0999999999967
CHARLIE AND LOLA FIGURES TINS,CHARLIE AND LOLA TABLE TINS,LUNCH BAG SUKI DESIGN ,SPOTTY BUNTING,99,3775.8499999999995
FRENCH TOILET SIGN BLUE METAL,PARTY BUNTING,FRENCH WC SIGN BLUE METAL,TOILET METAL SIGN,126,3763.640000000001
LADS ONLY TISSUE BOX,WHITE HANGING HEART T-LIGHT HOLDER,MOTORING TISSUE BOX,REX CASH+CARRY JUMBO SHOPPER,72,3761.39
50'S CHRISTMAS PAPER GIFT BAG,6 GIFT TAGS 50'S CHRISTMAS ,PAPER CHAIN KIT 50'S CHRISTMAS ,RED SPOT PAPER GIFT BAG,107,3754.4900000000007
LAVENDER SCENTED FABRIC HEART,REGENCY CAKESTAND 3 TIER,PARTY BUNTING,WHITE HANGING HEART T-LIGHT HOLDER,85,3754.27
CHRISTMAS HANGING STAR WITH BELL,WOODEN HEART CHRISTMAS SCANDINAVIAN,WOODEN STAR CHRISTMAS SCANDINAVIAN,HANGING HEART WITH BELL,172,3753.1099999999997
LARGE ANTIQUE WHITE PHOTO FRAME,WOODEN PICTURE FRAME WHITE FINISH,PHOTO FRAME CORNICE,WOODEN FRAME ANTIQUE WHITE ,102,3752.2499999999995
HEART T-LIGHT HOLDER WILLIE WINKIE,STAR T-LIGHT HOLDER WILLIE WINKIE,WHITE HANGING HEART T-LIGHT HOLDER,PAPER CHAIN KIT 50'S CHRISTMAS ,98,3748.2899999999995
36 FOIL STAR CAKE CASES ,REGENCY CAKESTAND 3 TIER,PACK OF 72 RETROSPOT CAKE CASES,SET OF 12 FAIRY CAKE BAKING CASES,69,3747.179999999999
"KEY FOB , FRONT  DOOR ","KEY FOB , GARAGE DESIGN","KEY FOB , SHED",WHITE HANGING HEART T-LIGHT HOLDER,196,3732.109999999999
FOLKART ZINC HEART CHRISTMAS DEC,WHITE HANGING HEART T-LIGHT HOLDER,ZINC METAL HEART DECORATION,HEART IVORY TRELLIS LARGE,124,3720.8599999999997
FILIGREE HEART BUTTERFLY WHITE ,HEART OF WICKER SMALL,FILIGREE HEART DAISY WHITE,WHITE HANGING HEART T-LIGHT HOLDER,86,3717.040000000001
ENGLISH ROSE NOTEBOOK A7 SIZE,FAIRY CAKES NOTEBOOK A7 SIZE,WHITE HANGING HEART T-LIGHT HOLDER,PARTY BUNTING,165,3706.969999999998
PACK OF 20 SPACEBOY NAPKINS,SET/20 RED RETROSPOT PAPER NAPKINS ,PACK OF 72 RETROSPOT CAKE CASES,PACK OF 60 SPACEBOY CAKE CASES,119,3704.7000000000016
GUMBALL MAGAZINE RACK,REGENCY CAKESTAND 3 TIER,JAM MAKING SET WITH JARS,SET/5 RED RETROSPOT LID GLASS BOWLS,72,3704.33
AIRLINE BAG VINTAGE TOKYO 78,AIRLINE BAG VINTAGE WORLD CHAMPION ,WHITE HANGING HEART T-LIGHT HOLDER,ALARM CLOCK BAKELIKE RED ,160,3701.06
LARGE RED RETROSPOT WINDMILL,SMALL RED RETROSPOT WINDMILL,LUNCH BAG RED RETROSPOT,PARTY BUNTING,100,3684.6499999999996
MAGIC DRAWING SLATE PURDEY,VINTAGE HEADS AND TAILS CARD GAME ,VINTAGE SNAP CARDS,MAGIC DRAWING SLATE SPACEBOY ,121,3682.2199999999993
WHITE METAL LANTERN,WOOD 2 DRAWER CABINET WHITE FINISH,WOOD S/3 CABINET ANT WHITE FINISH,WOODEN PICTURE FRAME WHITE FINISH,86,3679.769999999999
MAN FLU METAL SIGN,PLEASE ONE PERSON METAL SIGN,YOU'RE CONFUSING ME METAL SIGN ,METAL SIGN TAKE IT OR LEAVE IT ,156,3676.8300000000004
CHRISTMAS RETROSPOT STAR WOOD,CHRISTMAS RETROSPOT TREE WOOD,PAPER CHAIN KIT 50'S CHRISTMAS ,RETROSPOT WOODEN HEART DECORATION,183,3665.0799999999986
CARDHOLDER GINGHAM CHRISTMAS TREE,WHITE HANGING HEART T-LIGHT HOLDER,PAPER CHAIN KIT 50'S CHRISTMAS ,CHRISTMAS CRAFT TREE TOP ANGEL,65,3662.4700000000003
OVEN MITT APPLES DESIGN,PEG BAG APPLES DESIGN,RED RETROSPOT OVEN GLOVE ,SET OF 2 TEA TOWELS APPLE AND PEARS,151,3661.2
SMALL CHOCOLATES PINK BOWL,WHITE HANGING HEART T-LIGHT HOLDER,SMALL DOLLY MIX DESIGN ORANGE BOWL,SMALL MARSHMALLOWS PINK BOWL,303,3659.610000000002
SET OF 6 NATIVITY MAGNETS ,WHITE HANGING HEART T-LIGHT HOLDER,SET OF 60 PANTRY DESIGN CAKE CASES ,SET OF 6 RIBBONS VINTAGE CHRISTMAS,69,3659.0200000000004
MAKE YOUR OWN FLOWERPOWER CARD KIT,MAKE YOUR OWN MONSOON CARD KIT,POPPY'S PLAYHOUSE KITCHEN,MAKE YOUR OWN PLAYTIME CARD KIT,132,3654.1399999999994
WHITE WOOD GARDEN PLANT LADDER,WOOD BLACK BOARD ANT WHITE FINISH,WOODEN PICTURE FRAME WHITE FINISH,ZINC METAL HEART DECORATION,115,3626.5499999999997
ROMANTIC PINKS RIBBONS ,SCANDINAVIAN REDS RIBBONS,URBAN BLACK RIBBONS ,WHITE HANGING HEART T-LIGHT HOLDER,176,3621.8399999999997
EASTER TIN CHICKS PINK DAISY,EASTER TIN KEEPSAKE,SET OF 3 CAKE TINS PANTRY DESIGN ,SET 3 PAPER VINTAGE CHICK PAPER EGG,106,3615.249999999999
RIBBON REEL LACE DESIGN ,WHITE HANGING HEART T-LIGHT HOLDER,RIBBON REEL POLKADOTS ,RIBBON REEL STRIPES DESIGN ,114,3612.8
12 PENCILS TALL TUBE SKULLS,12 PENCILS TALL TUBE WOODLAND,WHITE HANGING HEART T-LIGHT HOLDER,LUNCH BAG  BLACK SKULL.,201,3609.1500000000005
20 DOLLY PEGS RETROSPOT,CLOTHES PEGS RETROSPOT PACK 24 ,JAM MAKING SET PRINTED,PACK OF 72 RETROSPOT CAKE CASES,125,3607.830000000001
PHOTO CUBE,WHITE HANGING HEART T-LIGHT HOLDER,PLASTERS IN TIN SPACEBOY,POPCORN HOLDER,91,3605.9999999999995
CREAM WALL PLANTER HEART SHAPED,NATURAL SLATE HEART CHALKBOARD ,JAM MAKING SET WITH JARS,WHITE HANGING HEART T-LIGHT HOLDER,88,3602.5899999999992
ALUMINIUM STAMPED HEART,WHITE HANGING HEART T-LIGHT HOLDER,ASSORTED COLOUR BIRD ORNAMENT,HANGING ENGRAVED METAL HEART,110,3601.9300000000007
APPLE BATH SPONGE,LUNCH BAG RED RETROSPOT,STRAWBERRY BATH SPONGE ,WHITE HANGING HEART T-LIGHT HOLDER,121,3596.5299999999997
6 EGG HOUSE PAINTED WOOD,REGENCY CAKESTAND 3 TIER,WHITE HANGING HEART T-LIGHT HOLDER,SET OF 3 CAKE TINS PANTRY DESIGN ,87,3595.0899999999992
AIRLINE BAG VINTAGE JET SET BROWN,AIRLINE BAG VINTAGE JET SET RED,AIRLINE BAG VINTAGE TOKYO 78,AIRLINE BAG VINTAGE WORLD CHAMPION ,149,3588.0
3 RAFFIA RIBBONS 50'S CHRISTMAS ,3 RAFFIA RIBBONS VINTAGE CHRISTMAS,PAPER CHAIN KIT 50'S CHRISTMAS ,WOODEN HEART CHRISTMAS SCANDINAVIAN,106,3586.6999999999985
FRENCH WC SIGN BLUE METAL,WHITE HANGING HEART T-LIGHT HOLDER,TOILET METAL SIGN,TOILET SIGN OCCUPIED OR VACANT,133,3584.11
KINGS CHOICE BISCUIT TIN,KINGS CHOICE TEA CADDY ,SET OF 3 CAKE TINS PANTRY DESIGN ,REGENCY CAKESTAND 3 TIER,74,3584.06
DOORMAT VINTAGE LEAVES DESIGN ,LUNCH BAG VINTAGE LEAF DESIGN,DOORMAT WELCOME PUPPIES,JUMBO BAG VINTAGE LEAF,54,3581.5299999999997
COWBOYS AND INDIANS BIRTHDAY CARD ,VINTAGE KID DOLLY CARD ,SPACEBOY BIRTHDAY CARD,TEA PARTY BIRTHDAY CARD,226,3579.1300000000006
SET 12 RETRO WHITE CHALK STICKS,VINTAGE SNAP CARDS,WHITE HANGING HEART T-LIGHT HOLDER,WOODEN PICTURE FRAME WHITE FINISH,139,3566.8899999999985
SET OF 9 BLACK SKULL BALLOONS,SET/20 RED RETROSPOT PAPER NAPKINS ,SKULLS PARTY BAG + STICKER SET,SET OF 9 HEART SHAPED BALLOONS,116,3566.840000000001
KITCHEN METAL SIGN,TOILET METAL SIGN,WHITE HANGING HEART T-LIGHT HOLDER,LAUNDRY 15C METAL SIGN,253,3563.0000000000005
FRENCH BLUE METAL DOOR SIGN 7,FRENCH BLUE METAL DOOR SIGN 8,FRENCH BLUE METAL DOOR SIGN No,FRENCH BLUE METAL DOOR SIGN 9,131,3556.66
SET 12 KIDS COLOUR  CHALK STICKS,VINTAGE SNAP CARDS,SET 12 RETRO WHITE CHALK STICKS,WORLD WAR 2 GLIDERS ASSTD DESIGNS,178,3555.359999999999
FRENCH KITCHEN SIGN BLUE METAL,FRENCH LAUNDRY SIGN BLUE METAL,FRENCH TOILET SIGN BLUE METAL,FRENCH WC SIGN BLUE METAL,129,3550.31
WOODEN SCHOOL COLOURING SET,WORLD WAR 2 GLIDERS ASSTD DESIGNS,ZINC METAL HEART DECORATION,ZINC FOLKART SLEIGH BELLS,93,3543.579999999999
BLUE POLKADOT GARDEN PARASOL,JUMBO BAG PINK POLKADOT,PARTY BUNTING,PINK POLKADOT GARDEN PARASOL,52,3535.2699999999995
LARGE POPCORN HOLDER ,PAPER CHAIN KIT VINTAGE CHRISTMAS,SMALL POPCORN HOLDER,PACK OF 72 RETROSPOT CAKE CASES,61,3523.9999999999995
BROCADE RING PURSE ,SET/20 RED RETROSPOT PAPER NAPKINS ,REX CASH+CARRY JUMBO SHOPPER,WHITE HANGING HEART T-LIGHT HOLDER,94,3523.640000000001
SET OF SALT AND PEPPER TOADSTOOLS,SET/5 RED RETROSPOT LID GLASS BOWLS,STRAWBERRY CERAMIC TRINKET BOX,WHITE HANGING HEART T-LIGHT HOLDER,92,3518.0400000000004
EMBROIDERED RIBBON REEL RACHEL ,EMBROIDERED RIBBON REEL SALLY ,EMBROIDERED RIBBON REEL REBECCA ,EMBROIDERED RIBBON REEL SUSIE ,71,3508.6900000000005
KEY CABINET MA CAMPAGNE,REGENCY CAKESTAND 3 TIER,WOOD BLACK BOARD ANT WHITE FINISH,WHITE HANGING HEART T-LIGHT HOLDER,57,3505.1000000000004
CARD BILLBOARD FONT,"FANCY FONT BIRTHDAY CARD, ",SPACEBOY BIRTHDAY CARD,SWALLOWS GREETING CARD,264,3502.5800000000017
"FEATHER PEN,HOT PINK","FEATHER PEN,LIGHT PINK",WHITE HANGING HEART T-LIGHT HOLDER,GARDENERS KNEELING PAD KEEP CALM ,130,3502.3999999999987
TRADITIONAL PICK UP STICKS GAME ,TRADTIONAL ALPHABET STAMP SET,VINTAGE SNAP CARDS,WOODEN BOX OF DOMINOES,151,3495.2000000000007
CHRISTMAS GINGHAM TREE,WOODEN HEART CHRISTMAS SCANDINAVIAN,WOODEN STAR CHRISTMAS SCANDINAVIAN,GINGHAM HEART DECORATION,179,3493.039999999999
OFFICE MUG WARMER CHOC+BLUE,OFFICE MUG WARMER PINK,OFFICE MUG WARMER POLKADOT,WHITE HANGING HEART T-LIGHT HOLDER,85,3485.760000000001
BIRD HOUSE HOT WATER BOTTLE,SCOTTIE DOG HOT WATER BOTTLE,RETROSPOT HEART HOT WATER BOTTLE,CHICK GREY HOT WATER BOTTLE,163,3472.749999999999
VICTORIAN  METAL POSTCARD SPRING,WHITE HANGING HEART T-LIGHT HOLDER,WOODEN PICTURE FRAME WHITE FINISH,WOODEN FRAME ANTIQUE WHITE ,82,3453.9400000000005
TRAVEL CARD WALLET I LOVE LONDON,TRAVEL CARD WALLET KEEP CALM,TRAVEL CARD WALLET UNION JACK,TRAVEL CARD WALLET VINTAGE TICKET,234,3449.460000000001
VINTAGE DOILY TRAVEL SEWING KIT,WHITE HANGING HEART T-LIGHT HOLDER,WOODEN HEART CHRISTMAS SCANDINAVIAN,WOODEN STAR CHRISTMAS SCANDINAVIAN,124,3427.59
TOILET SIGN OCCUPIED OR VACANT,WOODEN PICTURE FRAME WHITE FINISH,WASHROOM METAL SIGN,WHITE HANGING HEART T-LIGHT HOLDER,124,3426.8399999999992
PINK PAPER PARASOL ,PURPLE PAPER PARASOL,WHITE HANGING HEART T-LIGHT HOLDER,RED PAPER PARASOL,91,3426.0600000000004
METAL SIGN NEIGHBOURHOOD WITCH ,PLEASE ONE PERSON METAL SIGN,YOU'RE CONFUSING ME METAL SIGN ,NO SINGING METAL SIGN,128,3422.9300000000003
DOORMAT WELCOME SUNRISE,LUNCH BAG SPACEBOY DESIGN ,SET OF 4 PANTRY JELLY MOULDS,DOORMAT WELCOME TO OUR HOME,53,3418.29
CARD MOTORBIKE SANTA,PAPER CHAIN KIT 50'S CHRISTMAS ,PAPER CHAIN KIT VINTAGE CHRISTMAS,ROLL WRAP VINTAGE CHRISTMAS,126,3414.44
KNICKERBOCKERGLORY MAGNET ASSORTED ,SET OF 4 JAM JAR MAGNETS,SET OF 5 MINI GROCERY MAGNETS,SET OF 5 PANCAKE DAY MAGNETS,86,3414.15
PINK  HEART SHAPE LOVE BUCKET ,SET OF 3 CAKE TINS PANTRY DESIGN ,RED HEART SHAPE LOVE BUCKET ,SMALL RED BABUSHKA NOTEBOOK ,79,3402.6800000000007
EMERGENCY FIRST AID TIN ,FIRST AID TIN,JAM MAKING SET PRINTED,REGENCY CAKESTAND 3 TIER,82,3397.62
IVORY SWEETHEART WIRE LETTER RACK ,ZINC SWEETHEART WIRE LETTER RACK,WHITE HANGING HEART T-LIGHT HOLDER,WOODEN PICTURE FRAME WHITE FINISH,110,3395.8900000000003
EASTER CRAFT 4 CHICKS ,FELTCRAFT BUTTERFLY HEARTS,FELTCRAFT 6 FLOWER FRIENDS,PAPER CHAIN KIT EMPIRE,104,3394.2499999999995
POTTERING MUG,POTTING SHED TEA MUG,WHITE HANGING HEART T-LIGHT HOLDER,SET OF 6 SPICE TINS PANTRY DESIGN,138,3392.38
HANGING CHICK  YELLOW DECORATION,WHITE HANGING HEART T-LIGHT HOLDER,HANGING CHICK CREAM DECORATION,HANGING CHICK GREEN DECORATION,115,3383.45
WALL ART STOP FOR TEA ,WALL ART VILLAGE SHOW ,WOODEN FRAME ANTIQUE WHITE ,WOODEN PICTURE FRAME WHITE FINISH,67,3381.8900000000003
GLITTER HANGING BUTTERFLY STRING,WHITE HANGING HEART T-LIGHT HOLDER,PARTY BUNTING,LUNCH BAG RED RETROSPOT,84,3381.25
DOORMAT NEIGHBOURHOOD WITCH ,DOORMAT RESPECTABLE HOUSE,JUMBO BAG RED RETROSPOT,JUMBO STORAGE BAG SUKI,51,3378.48
EASTER TIN KEEPSAKE,JAM MAKING SET PRINTED,SET OF 3 CAKE TINS PANTRY DESIGN ,SET 3 PAPER VINTAGE CHICK PAPER EGG,83,3374.9500000000003
FRENCH BLUE METAL DOOR SIGN 6,FRENCH BLUE METAL DOOR SIGN No,FRENCH BLUE METAL DOOR SIGN 7,FRENCH BLUE METAL DOOR SIGN 8,130,3374.82
CHILDREN'S CIRCUS PARADE MUG,CHILDREN'S SPACEBOY MUG,CHILDRENS DOLLY GIRL MUG,CIRCUS PARADE CHILDRENS EGG CUP ,114,3364.949999999999
HEART DECORATION PAINTED ZINC ,ZINC METAL HEART DECORATION,WHITE HANGING HEART T-LIGHT HOLDER,LOVEBIRD HANGING DECORATION WHITE ,128,3362.8099999999995
12 PENCILS SMALL TUBE SKULL,LUNCH BAG  BLACK SKULL.,PACK OF 72 RETROSPOT CAKE CASES,PACK OF 72 SKULL CAKE CASES,170,3361.3499999999995
I LOVE LONDON BEAKER,SPACEBOY BEAKER,LUNCH BOX I LOVE LONDON,SET OF 4 KNICK KNACK TINS LONDON ,87,3358.5
TEA BAG PLATE RED RETROSPOT,TEA TIME OVEN GLOVE,WHITE HANGING HEART T-LIGHT HOLDER,TRAVEL SEWING KIT,100,3340.7000000000003
GINGHAM HEART  DOORSTOP RED,HEART OF WICKER SMALL,ROSE CARAVAN DOORSTOP,WHITE HANGING HEART T-LIGHT HOLDER,114,3318.550000000001
12 PENCIL SMALL TUBE WOODLAND,12 PENCILS SMALL TUBE SKULL,12 PENCILS SMALL TUBE RED RETROSPOT,SET 12 COLOUR PENCILS SPACEBOY ,274,3315.0500000000015
IF YOU CAN'T STAND THE HEAT MUG,POTTERING MUG,SAVE THE PLANET MUG,WHITE HANGING HEART T-LIGHT HOLDER,83,3298.310000000001
WRAP POPPIES  DESIGN,WRAP VINTAGE PETALS  DESIGN,WRAP RED APPLES ,WRAP VINTAGE LEAF DESIGN,102,3281.0
TOAST ITS - BEST MUM,WHITE HANGING HEART T-LIGHT HOLDER,TOAST ITS - HAPPY BIRTHDAY,TOAST ITS - I LOVE YOU ,59,3278.7999999999997
MINI PLAYING CARDS BUFFALO BILL ,MINI PLAYING CARDS DOLLY GIRL ,MINI PLAYING CARDS GYMKHANA,MINI PLAYING CARDS SPACEBOY ,152,3276.659999999999
STAR WOODEN CHRISTMAS DECORATION,WOODEN HEART CHRISTMAS SCANDINAVIAN,SWALLOW WOODEN CHRISTMAS DECORATION,WOODEN STAR CHRISTMAS SCANDINAVIAN,172,3268.2799999999997
ROTATING LEAVES T-LIGHT HOLDER,ROTATING SILVER ANGELS T-LIGHT HLDR,WHITE HANGING HEART T-LIGHT HOLDER,WOODEN HEART CHRISTMAS SCANDINAVIAN,102,3264.3499999999985
 I LOVE LONDON MINI BACKPACK,DOLLY GIRL MINI BACKPACK,SPACEBOY MINI BACKPACK,WOODLAND MINI BACKPACK,88,3262.25
SET OF 2 WOODEN MARKET CRATES,WHITE HANGING HEART T-LIGHT HOLDER,WHITE WOOD GARDEN PLANT LADDER,SPOTTY BUNTING,62,3257.1500000000005
DAISY GARDEN MARKER,NATURAL SLATE HEART CHALKBOARD ,WATERING CAN GARDEN MARKER,WHITE HANGING HEART T-LIGHT HOLDER,56,3252.4
ROSE SCENT CANDLE IN JEWELLED BOX,SET/3 VANILLA SCENTED CANDLE IN BOX,VANILLA SCENT CANDLE JEWELLED BOX,WHITE HANGING HEART T-LIGHT HOLDER,67,3249.04
SET/3 ROSE CANDLE IN JEWELLED BOX,SET/3 VANILLA SCENTED CANDLE IN BOX,VANILLA SCENT CANDLE JEWELLED BOX,WHITE HANGING HEART T-LIGHT HOLDER,68,3248.32
OFFICE MUG WARMER BLACK+SILVER ,OFFICE MUG WARMER POLKADOT,OFFICE MUG WARMER PINK,OFFICE MUG WARMER CHOC+BLUE,94,3230.49
RED RETROSPOT OVEN GLOVE DOUBLE,SET/2 RED RETROSPOT TEA TOWELS ,RED RETROSPOT PEG BAG,WHITE HANGING HEART T-LIGHT HOLDER,101,3222.500000000001
FILIGREE HEART BIRD WHITE ,FILIGREE HEART BUTTERFLY WHITE ,WHITE HANGING HEART T-LIGHT HOLDER,SET OF 3 WOODEN HEART DECORATIONS,83,3219.22
SET/20 STRAWBERRY PAPER NAPKINS ,WHITE HANGING HEART T-LIGHT HOLDER,WOODEN PICTURE FRAME WHITE FINISH,SPOTTY BUNTING,116,3216.55
POLYESTER FILLER PAD 45x45cm,WHITE HANGING HEART T-LIGHT HOLDER,WOODEN PICTURE FRAME WHITE FINISH,REGENCY CAKESTAND 3 TIER,73,3198.9999999999995
CHARLIE + LOLA RED HOT WATER BOTTLE,CHARLIE+LOLA PINK HOT WATER BOTTLE,RETROSPOT HEART HOT WATER BOTTLE,WHITE HANGING HEART T-LIGHT HOLDER,138,3177.17
GLASS HEART T-LIGHT HOLDER ,HEART OF WICKER SMALL,WHITE HANGING HEART T-LIGHT HOLDER,SMALL GLASS HEART TRINKET POT,82,3173.19
6 RIBBONS EMPIRE  ,6 RIBBONS RUSTIC CHARM,SCANDINAVIAN REDS RIBBONS,6 RIBBONS SHIMMERING PINKS ,127,3166.0200000000004
VICTORIAN SEWING BOX MEDIUM,VICTORIAN SEWING BOX SMALL ,WOODEN FRAME ANTIQUE WHITE ,WHITE HANGING HEART T-LIGHT HOLDER,99,3160.9399999999996
POPPY'S PLAYHOUSE LIVINGROOM ,VINTAGE SNAP CARDS,TRADITIONAL MODELLING CLAY,WHITE HANGING HEART T-LIGHT HOLDER,124,3156.3100000000004
EMBROIDERED RIBBON REEL REBECCA ,EMBROIDERED RIBBON REEL SUSIE ,EMBROIDERED RIBBON REEL SALLY ,EMBROIDERED RIBBON REEL SOPHIE  ,74,3131.17
RIBBON REEL FLORA + FAUNA ,RIBBON REEL HEARTS DESIGN ,RIBBON REEL STRIPES DESIGN ,SCANDINAVIAN REDS RIBBONS,129,3129.7999999999997
ENAMEL WASH BOWL CREAM,REGENCY CAKESTAND 3 TIER,WHITE HANGING HEART T-LIGHT HOLDER,SET OF 3 CAKE TINS PANTRY DESIGN ,69,3114.05
VINTAGE  2 METER FOLDING RULER,VINTAGE SNAP CARDS,WORLD WAR 2 GLIDERS ASSTD DESIGNS,WOODEN SCHOOL COLOURING SET,76,3104.7599999999993
GROW YOUR OWN BASIL IN ENAMEL MUG,WHITE HANGING HEART T-LIGHT HOLDER,RECIPE BOX PANTRY YELLOW DESIGN,PARTY BUNTING,86,3086.6
6 ROCKET BALLOONS ,PAPER CHAIN KIT 50'S CHRISTMAS ,WHITE HANGING HEART T-LIGHT HOLDER,BALLOON WATER BOMB PACK OF 35,103,3086.4
STRAWBERRY FAIRY CAKE TEAPOT,SWEETHEART CERAMIC TRINKET BOX,TEA TIME OVEN GLOVE,WHITE HANGING HEART T-LIGHT HOLDER,91,3081.09
BLUE PAPER PARASOL ,PURPLE PAPER PARASOL,RED PAPER PARASOL,PINK PAPER PARASOL ,81,3080.75
DOCTOR'S BAG SOFT TOY,TOOL BOX SOFT TOY ,PAPER CHAIN KIT 50'S CHRISTMAS ,RETROSPOT TEA SET CERAMIC 11 PC ,57,3079.9699999999993
PACK OF 12 RED RETROSPOT TISSUES ,PACK OF 72 RETROSPOT CAKE CASES,PACK OF 12 SUKI TISSUES ,PACK OF 12 WOODLAND TISSUES ,207,3076.029999999999
