Product_A,Recommendation_1,Recommendation_2,Recommendation_3,Total_CoPurchase_Count,Total_Incremental_Revenue_Potential
STRAWBERRY CERAMIC TRINKET POT,SWEETHEART CERAMIC TRINKET BOX,WHITE HANGING HEART T-LIGHT HOLDER,TEA TIME OVEN GLOVE,75,2239.91
PACK OF 12 PINK POLKADOT TISSUES,PACK OF 12 SUKI TISSUES ,PACK OF 12 RED RETROSPOT TISSUES ,PACK OF 12 WOODLAND TISSUES ,146,2235.4199999999996
BLUE/CREAM STRIPE CUSHION COVER ,UNION STRIPE CUSHION COVER ,RED/CREAM STRIPE CUSHION COVER ,CHILLI LIGHTS,103,2229.25
DAIRY MAID STRIPE MUG,WHITE HANGING HEART T-LIGHT HOLDER,DAIRY MAID TRADITIONAL TEAPOT ,DAIRY MAID TOASTRACK,58,2218.8700000000003
GIN & TONIC DIET GREETING CARD ,SPACEBOY BIRTHDAY CARD,TEA PARTY BIRTHDAY CARD,GIN + TONIC DIET METAL SIGN,113,2215.5
SMALL HEART MEASURING SPOONS,VINTAGE SNAP CARDS,WHITE HANGING HEART T-LIGHT HOLDER,TRADITIONAL KNITTING NANCY,104,2207.63
"FEATHER PEN,LIGHT PINK",WHITE HANGING HEART T-LIGHT HOLDER,GARDENERS KNEELING PAD KEEP CALM ,POPCORN HOLDER,72,2202.93
CHILDRENS GARDEN GLOVES BLUE,CHILDS GARDEN FORK BLUE ,CHILDS GARDEN TROWEL BLUE ,CHILDS GARDEN TROWEL PINK,124,2198.690000000001
SET 12 COLOUR PENCILS SPACEBOY ,SET 12 COLOURING PENCILS DOILY,VINTAGE HEADS AND TAILS CARD GAME ,VINTAGE SNAP CARDS,152,2197.15
APRON APPLE DELIGHT,PEG BAG APPLES DESIGN,WHITE HANGING HEART T-LIGHT HOLDER,CHILDRENS APRON APPLES DESIGN,68,2194.55
PENS ASSORTED FUNKY JEWELED ,PENS ASSORTED SPACEBALL,PENS ASSORTED FUNNY FACE,POPART WOODEN PENCILS ASST,86,2187.719999999999
TEA FOR ONE POLKADOT,WHITE HANGING HEART T-LIGHT HOLDER,WOOD 2 DRAWER CABINET WHITE FINISH,TEA TIME TEAPOT IN GIFT BOX,59,2186.6499999999996
DO NOT TOUCH MY STUFF DOOR HANGER ,MOODY BOY  DOOR HANGER ,MOODY GIRL DOOR HANGER ,TOXIC AREA  DOOR HANGER ,173,2179.8299999999995
CARD CIRCUS PARADE,ROBOT BIRTHDAY CARD,SPACEBOY BIRTHDAY CARD,TEA PARTY BIRTHDAY CARD,180,2174.000000000001
CHOC TRUFFLE GOLD TRINKET POT ,STRAWBERRY CERAMIC TRINKET BOX,SWEETHEART CERAMIC TRINKET BOX,PINK DOUGHNUT TRINKET POT ,76,2171.6899999999996
SWEETHEART WIRE WALL TIDY,WHITE HANGING HEART T-LIGHT HOLDER,WOODEN FRAME ANTIQUE WHITE ,WOODEN PICTURE FRAME WHITE FINISH,55,2157.5
WOODLAND CHARLOTTE BAG,ZINC METAL HEART DECORATION,WORLD WAR 2 GLIDERS ASSTD DESIGNS,WOODLAND MINI BACKPACK,61,2150.06
PENNY FARTHING BIRTHDAY CARD,SPACEBOY BIRTHDAY CARD,TEA PARTY BIRTHDAY CARD,RAINY LADIES BIRTHDAY CARD,167,2147.040000000001
SKETCHBOOK MAGNETIC SHOPPING LIST,SMALL WHITE HEART OF WICKER,WHITE HANGING HEART T-LIGHT HOLDER,VINTAGE LEAF MAGNETIC NOTEPAD,143,2139.97
VINTAGE GLASS T-LIGHT HOLDER,WHITE HANGING HEART T-LIGHT HOLDER,WOODEN PICTURE FRAME WHITE FINISH,WOODEN STAR CHRISTMAS SCANDINAVIAN,77,2139.77
GLITTER CHRISTMAS STAR ,WOODEN HEART CHRISTMAS SCANDINAVIAN,WOODEN STAR CHRISTMAS SCANDINAVIAN,GLITTER HEART DECORATION,147,2139.75
CITRONELLA CANDLE GARDEN POT,WHITE HANGING HEART T-LIGHT HOLDER,VICTORIAN GLASS HANGING T-LIGHT,PARTY BUNTING,71,2135.55
CHRISTMAS TREE HANGING SILVER ,LAUREL HEART ANTIQUE SILVER,SET OF 3 WOODEN HEART DECORATIONS,REINDEER HEART DECORATION SILVER,88,2134.7
CHARLIE & LOLA WASTEPAPER BIN BLUE,CHARLIE & LOLA WASTEPAPER BIN FLORA,LUNCH BAG RED RETROSPOT,LUNCH BAG SPACEBOY DESIGN ,108,2133.95
FRENCH LAUNDRY SIGN BLUE METAL,FRENCH WC SIGN BLUE METAL,FRENCH TOILET SIGN BLUE METAL,TOILET SIGN OCCUPIED OR VACANT,88,2129.6199999999994
CHRISTMAS PUDDING TRINKET POT ,WOODEN STAR CHRISTMAS SCANDINAVIAN,WOODEN TREE CHRISTMAS SCANDINAVIAN,WOODEN HEART CHRISTMAS SCANDINAVIAN,109,2117.8399999999992
FRIDGE MAGNETS LES ENFANTS ASSORTED,FRIDGE MAGNETS US DINER ASSORTED,GIN + TONIC DIET METAL SIGN,PLEASE ONE PERSON METAL SIGN,63,2110.14
RED RETROSPOT TAPE,ROUND SNACK BOXES SET OF4 WOODLAND ,STARS GIFT TAPE ,SET/20 RED RETROSPOT PAPER NAPKINS ,90,2109.4100000000008
FELTCRAFT HAIRBAND PINK AND PURPLE,FELTCRAFT HAIRBANDS PINK AND WHITE ,PINK CREAM FELT CRAFT TRINKET BOX ,PINK BLUE FELT CRAFT TRINKET BOX,142,2108.24
KEY RING BASEBALL BOOT UNION JACK,PLAYING CARDS JUBILEE UNION JACK,PLAYING CARDS KEEP CALM & CARRY ON,POPCORN HOLDER,59,2102.69
GOLD MUG BONE CHINA TREE OF LIFE,WHITE HANGING HEART T-LIGHT HOLDER,SILVER MUG BONE CHINA TREE OF LIFE,PAPER CHAIN KIT 50'S CHRISTMAS ,52,2101.38
CHILDS GARDEN BRUSH BLUE,CHILDS GARDEN BRUSH PINK,CHILDS GARDEN SPADE BLUE,CHILDS GARDEN TROWEL BLUE ,102,2101.200000000001
VINTAGE BILLBOARD DRINK ME MUG,VINTAGE BILLBOARD LOVE/HATE MUG,WHITE HANGING HEART T-LIGHT HOLDER,VINTAGE BILLBOARD MUG ,105,2089.9
WRAP 50'S  CHRISTMAS,WRAP RED APPLES ,WRAP CHRISTMAS VILLAGE,WRAP VINTAGE LEAF DESIGN,79,2087.34
ELEPHANT BIRTHDAY CARD ,SPACEBOY BIRTHDAY CARD,PAPER CHAIN KIT 50'S CHRISTMAS ,VINTAGE KID DOLLY CARD ,71,2086.07
3 GARDENIA MORRIS BOXED CANDLES,ROSE 3 WICK MORRIS BOX CANDLE,3 ROSE MORRIS BOXED CANDLES,WHITE HANGING HEART T-LIGHT HOLDER,79,2085.15
BRIGHT BLUES RIBBONS ,CHOCOLATE BOX RIBBONS ,ROMANTIC PINKS RIBBONS ,SCANDINAVIAN REDS RIBBONS,169,2085.0
CACTI T-LIGHT CANDLES,WHITE HANGING HEART T-LIGHT HOLDER,COLOUR GLASS T-LIGHT HOLDER HANGING,PACK OF 72 RETROSPOT CAKE CASES,59,2083.7100000000005
WRAP PINK FAIRY CAKES ,WRAP RED APPLES ,WRAP SUKI AND FRIENDS,WRAP POPPIES  DESIGN,58,2062.5
RED STAR CARD HOLDER,WHITE HANGING HEART T-LIGHT HOLDER,WOODEN STAR CHRISTMAS SCANDINAVIAN,WOODEN HEART CHRISTMAS SCANDINAVIAN,92,2060.98
ROCKING HORSE RED CHRISTMAS ,WOODEN HEART CHRISTMAS SCANDINAVIAN,WOODEN STAR CHRISTMAS SCANDINAVIAN,SET OF 3 WOODEN SLEIGH DECORATIONS,144,2057.6599999999994
CITRONELLA CANDLE FLOWERPOT,WHITE HANGING HEART T-LIGHT HOLDER,CITRONELLA CANDLE GARDEN POT,NATURAL SLATE HEART CHALKBOARD ,90,2054.5
TRAVEL CARD WALLET VINTAGE TICKET,WOODEN PICTURE FRAME WHITE FINISH,VINTAGE SNAP CARDS,WHITE HANGING HEART T-LIGHT HOLDER,93,2047.8700000000001
AIRLINE BAG VINTAGE JET SET WHITE,AIRLINE BAG VINTAGE WORLD CHAMPION ,AIRLINE BAG VINTAGE TOKYO 78,ALARM CLOCK BAKELIKE RED ,102,2044.56
HANGING HEART WITH BELL,WOODEN HEART CHRISTMAS SCANDINAVIAN,WOODEN STAR CHRISTMAS SCANDINAVIAN,WOODEN TREE CHRISTMAS SCANDINAVIAN,117,2043.1
12 COLOURED PARTY BALLOONS,6 ROCKET BALLOONS ,BALLOON PUMP WITH 10 BALLOONS,SET OF 9 BLACK SKULL BALLOONS,98,2041.2500000000005
FIVE HEART HANGING DECORATION,HEART OF WICKER SMALL,WHITE HANGING HEART T-LIGHT HOLDER,MOBILE VINTAGE HEARTS ,56,2037.2999999999997
HEART MINI PORTRAIT FRAME,SMALL WHITE HEART OF WICKER,OVAL  MINI PORTRAIT FRAME,SQUARE MINI PORTRAIT FRAME,88,2034.1499999999994
MAGNETS PACK OF 4 HOME SWEET HOME,MAGNETS PACK OF 4 VINTAGE COLLAGE,MAGNETS PACK OF 4 RETRO PHOTO,MAGNETS PACK OF 4 SWALLOWS,213,2028.3399999999997
WOOD STOCKING CHRISTMAS SCANDISPOT,WOODEN TREE CHRISTMAS SCANDINAVIAN,WOODEN HEART CHRISTMAS SCANDINAVIAN,WOODEN STAR CHRISTMAS SCANDINAVIAN,153,2026.9299999999985
ASSORTED BOTTLE TOP  MAGNETS ,FRIDGE MAGNETS US DINER ASSORTED,ASSORTED COLOUR BIRD ORNAMENT,REGENCY CAKESTAND 3 TIER,70,2022.8600000000001
POLKADOT RAIN HAT ,RAIN PONCHO RETROSPOT,VINTAGE SNAP CARDS,SET OF 4 PANTRY JELLY MOULDS,99,2021.0100000000002
EGG CUP MILKMAID HEIDI,EGG CUP MILKMAID HELGA ,EGG CUP MILKMAID INGRID,RABBIT NIGHT LIGHT,59,2020.3
GARAGE KEY FOB,"KEY FOB , SHED","KEY FOB , BACK DOOR ","KEY FOB , FRONT  DOOR ",227,2017.3400000000001
SET OF 2 TRAYS HOME SWEET HOME,SHELF WITH 4 HOOKS HOME SWEET HOME,SET OF 3 REGENCY CAKE TINS,WHITE HANGING HEART T-LIGHT HOLDER,59,2008.1
MINI PLAYING CARDS SPACEBOY ,SET 12 COLOUR PENCILS SPACEBOY ,SET 12 COLOUR PENCILS DOLLY GIRL ,PAPER CHAIN KIT 50'S CHRISTMAS ,103,2006.4999999999998
WHITE BROCANTE SOAP DISH,WHITE HANGING HEART T-LIGHT HOLDER,ZINC METAL HEART DECORATION,WOODEN PICTURE FRAME WHITE FINISH,64,2006.3999999999999
NO JUNK MAIL METAL SIGN,NO SINGING METAL SIGN,PLEASE ONE PERSON METAL SIGN,WHITE HANGING HEART T-LIGHT HOLDER,99,1998.4999999999998
CERAMIC PIRATE CHEST MONEY BANK,WHITE HANGING HEART T-LIGHT HOLDER,LUNCH BAG RED RETROSPOT,LUNCH BAG  BLACK SKULL.,75,1996.7999999999997
BAG 500g SWIRLY MARBLES,BLUE HARMONICA IN BOX ,VINTAGE SNAP CARDS,WOODEN BOX OF DOMINOES,82,1979.37
SLATE TILE NATURAL HANGING,WHITE HANGING HEART T-LIGHT HOLDER,VICTORIAN GLASS HANGING T-LIGHT,WOODEN HEART CHRISTMAS SCANDINAVIAN,57,1969.8600000000001
KNEELING MAT HOUSEWORK  DESIGN,WHITE HANGING HEART T-LIGHT HOLDER,LUNCH BAG CARS BLUE,SET OF 4 PANTRY JELLY MOULDS,95,1968.5100000000002
HEART MIRROR ANTIQUE WHITE,WOODEN FRAME ANTIQUE WHITE ,WOODEN PICTURE FRAME WHITE FINISH,HOT WATER BOTTLE KEEP CALM,50,1966.65
WHITE ROCKING HORSE HAND PAINTED,ZINC FOLKART SLEIGH BELLS,WOODEN HEART CHRISTMAS SCANDINAVIAN,WOODEN STAR CHRISTMAS SCANDINAVIAN,88,1951.4800000000002
STRAWBERRY BATH SPONGE ,WHITE HANGING HEART T-LIGHT HOLDER,TEA BAG PLATE RED RETROSPOT,TRADITIONAL KNITTING NANCY,69,1948.93
CHRISTMAS TREE HANGING GOLD,CHRISTMAS TREE HANGING SILVER ,REINDEER HEART DECORATION GOLD,SET OF 3 WOODEN HEART DECORATIONS,81,1935.85
TOY TIDY SPACEBOY  ,WHITE HANGING HEART T-LIGHT HOLDER,TRADITIONAL KNITTING NANCY,WOODLAND CHARLOTTE BAG,86,1935.8300000000002
FOLKART STAR CHRISTMAS DECORATIONS,WOODEN HEART CHRISTMAS SCANDINAVIAN,WOODEN STAR CHRISTMAS SCANDINAVIAN,WOODEN TREE CHRISTMAS SCANDINAVIAN,90,1932.9299999999998
SILK PURSE BABUSHKA BLUE,SILK PURSE BABUSHKA RED,SILK PURSE BABUSHKA PINK,WHITE HANGING HEART T-LIGHT HOLDER,74,1925.1000000000004
VINTAGE  2 METRE FOLDING RULER,VINTAGE DOILY TRAVEL SEWING KIT,WORLD WAR 2 GLIDERS ASSTD DESIGNS,VINTAGE SNAP CARDS,68,1919.6
CHRISTMAS HANGING TREE WITH BELL,WOODEN HEART CHRISTMAS SCANDINAVIAN,WOODEN STAR CHRISTMAS SCANDINAVIAN,HANGING HEART WITH BELL,103,1917.9499999999998
RAINY LADIES BIRTHDAY CARD,SPACEBOY BIRTHDAY CARD,ROBOT BIRTHDAY CARD,TEA PARTY BIRTHDAY CARD,120,1916.5700000000006
CHARLIE + LOLA BISCUITS TINS,CHARLIE AND LOLA FIGURES TINS,CHARLIE AND LOLA TABLE TINS,SMALL DOLLY MIX DESIGN ORANGE BOWL,61,1915.2699999999998
REINDEER HEART DECORATION SILVER,SET OF 3 WOODEN HEART DECORATIONS,SET OF 3 WOODEN SLEIGH DECORATIONS,SET OF 3 WOODEN TREE DECORATIONS,79,1914.4900000000002
Manual,REX CASH+CARRY JUMBO SHOPPER,REGENCY CAKESTAND 3 TIER,WHITE HANGING HEART T-LIGHT HOLDER,96,1906.5099999999998
FRYING PAN PINK POLKADOT,FRYING PAN RED RETROSPOT,MILK PAN RED RETROSPOT,SET/5 RED RETROSPOT LID GLASS BOWLS,62,1901.12
CHERUB HEART DECORATION GOLD,CHERUB HEART DECORATION SILVER ,CHRISTMAS TREE HANGING GOLD,REINDEER HEART DECORATION GOLD,85,1900.6399999999994
COFFEE MUG BLUE PAISLEY DESIGN,REGENCY CAKESTAND 3 TIER,WHITE HANGING HEART T-LIGHT HOLDER,COFFEE MUG PINK PAISLEY DESIGN,58,1881.38
MULTICOLOUR HONEYCOMB FAN,SPACEBOY LUNCH BOX ,PINK  HONEYCOMB PAPER FAN,PASTEL COLOUR HONEYCOMB FAN,56,1878.0800000000004
SMALL RED BABUSHKA NOTEBOOK ,WHITE HANGING HEART T-LIGHT HOLDER,SMALL YELLOW BABUSHKA NOTEBOOK ,WOODLAND CHARLOTTE BAG,184,1875.41
MINI JIGSAW PURDEY,MINI JIGSAW SPACEBOY,VINTAGE HEADS AND TAILS CARD GAME ,VINTAGE SNAP CARDS,60,1871.1899999999998
POLYESTER FILLER PAD 40x40cm,REGENCY CAKESTAND 3 TIER,POLYESTER FILLER PAD 45x45cm,POSTE FRANCE CUSHION COVER,73,1867.4499999999998
CARD SUKI BIRTHDAY,LUNCH BAG RED RETROSPOT,SPACEBOY BIRTHDAY CARD,ROBOT BIRTHDAY CARD,118,1862.85
FRENCH GARDEN SIGN BLUE METAL,FRENCH WC SIGN BLUE METAL,FRENCH KITCHEN SIGN BLUE METAL,FRENCH TOILET SIGN BLUE METAL,106,1861.9700000000003
VINTAGE CHRISTMAS PAPER GIFT BAG,VINTAGE CHRISTMAS TABLECLOTH,WRAP CHRISTMAS VILLAGE,VINTAGE CHRISTMAS STOCKING ,50,1861.7400000000002
MORE BUTTER METAL SIGN ,NO SINGING METAL SIGN,PLEASE ONE PERSON METAL SIGN,YOU'RE CONFUSING ME METAL SIGN ,102,1861.21
ORGANISER WOOD ANTIQUE WHITE ,WHITE HANGING HEART T-LIGHT HOLDER,WHITE WOOD GARDEN PLANT LADDER,SET OF 3 CAKE TINS PANTRY DESIGN ,59,1856.3000000000002
FAIRY CAKES NOTEBOOK A6 SIZE,FAIRY CAKES NOTEBOOK A7 SIZE,JUMBO BAG RED RETROSPOT,WHITE HANGING HEART T-LIGHT HOLDER,107,1855.77
SET 36 COLOURING PENCILS DOILY,SET OF 4 KNICK KNACK TINS DOILY ,WHITE HANGING HEART T-LIGHT HOLDER,VINTAGE DOILY TRAVEL SEWING KIT,57,1855.4
MOODY GIRL DOOR HANGER ,WHITE HANGING HEART T-LIGHT HOLDER,TOXIC AREA  DOOR HANGER ,RED CHARLIE+LOLA PERSONAL DOORSIGN,156,1853.8799999999994
CHILDS GARDEN FORK PINK,CHILDS GARDEN TROWEL PINK,CHILDS GARDEN TROWEL BLUE ,CHILDS GARDEN SPADE PINK,169,1853.3999999999992
SET OF 2 CHRISTMAS DECOUPAGE CANDLE,WHITE HANGING HEART T-LIGHT HOLDER,WOODEN STAR CHRISTMAS SCANDINAVIAN,WOODEN HEART CHRISTMAS SCANDINAVIAN,96,1852.6900000000005
LIPSTICK PEN RED,WHITE HANGING HEART T-LIGHT HOLDER,TRADITIONAL KNITTING NANCY,PACK OF 60 DINOSAUR CAKE CASES,96,1848.84
WOOD STAMP SET BEST WISHES,WOOD STAMP SET HAPPY BIRTHDAY,WOOD STAMP SET THANK YOU,WOOD STAMP SET FLOWERS,204,1847.54
DINOSAURS  WRITING SET ,SKULLS WRITING SET ,WHITE HANGING HEART T-LIGHT HOLDER,LUNCH BAG  BLACK SKULL.,149,1847.29
CARAVAN SQUARE TISSUE BOX,WHITE HANGING HEART T-LIGHT HOLDER,EMPIRE TISSUE BOX,MOTORING TISSUE BOX,129,1846.7699999999995
ENGLISH ROSE SPIRIT LEVEL ,PLASTERS IN TIN VINTAGE PAISLEY ,WHITE HANGING HEART T-LIGHT HOLDER,POPCORN HOLDER,75,1843.47
PARTY PIZZA DISH GREEN POLKADOT,PARTY PIZZA DISH PINK POLKADOT,SMALL POPCORN HOLDER,PARTY PIZZA DISH RED RETROSPOT,64,1837.0700000000002
"ELEPHANT, BIRTHDAY CARD, ",VINTAGE KID DOLLY CARD ,SPACEBOY BIRTHDAY CARD,TEA PARTY BIRTHDAY CARD,138,1836.7200000000005
RED LOVE HEART SHAPE CUP,WHITE HANGING HEART T-LIGHT HOLDER,SET OF 3 HEART COOKIE CUTTERS,SMALL HEART MEASURING SPOONS,66,1823.4899999999996
FLOWER VINE RAFFIA FOOD COVER,RED FLOWER CROCHET FOOD COVER,WHITE HANGING HEART T-LIGHT HOLDER,STRAWBERRY RAFFIA FOOD COVER,86,1817.2600000000002
VINTAGE BELLS GARLAND,WHITE HANGING HEART T-LIGHT HOLDER,WOODEN STAR CHRISTMAS SCANDINAVIAN,WOODEN HEART CHRISTMAS SCANDINAVIAN,63,1811.3000000000004
BLACK DINER WALL CLOCK,BLUE DINER WALL CLOCK,IVORY DINER WALL CLOCK,RED DINER WALL CLOCK,53,1810.5
STAR DECORATION PAINTED ZINC ,WOODEN HEART CHRISTMAS SCANDINAVIAN,WOODEN TREE CHRISTMAS SCANDINAVIAN,WOODEN STAR CHRISTMAS SCANDINAVIAN,129,1807.7700000000002
GLITTER HEART DECORATION,WHITE HANGING HEART T-LIGHT HOLDER,WOODEN HEART CHRISTMAS SCANDINAVIAN,WOODEN STAR CHRISTMAS SCANDINAVIAN,128,1805.24
COSY HOUR CIGAR BOX MATCHES ,WHITE HANGING HEART T-LIGHT HOLDER,REX CASH+CARRY JUMBO SHOPPER,HOT WATER BOTTLE KEEP CALM,80,1800.25
CHARLIE & LOLA WASTEPAPER BIN FLORA,CHARLIE AND LOLA FIGURES TINS,LUNCH BAG SPACEBOY DESIGN ,WHITE HANGING HEART T-LIGHT HOLDER,75,1798.6499999999999
MAKE YOUR OWN MONSOON CARD KIT,MAKE YOUR OWN PLAYTIME CARD KIT,PAPER CHAIN KIT 50'S CHRISTMAS ,POPPY'S PLAYHOUSE KITCHEN,79,1797.3199999999997
SET OF 4 ENGLISH ROSE PLACEMATS,WHITE HANGING HEART T-LIGHT HOLDER,SET OF 6 SPICE TINS PANTRY DESIGN,SET OF 4 PANTRY JELLY MOULDS,73,1796.8300000000002
PLAYING CARDS I LOVE LONDON ,PLAYING CARDS KEEP CALM & CARRY ON,PLAYING CARDS JUBILEE UNION JACK,SET 12 COLOUR PENCILS LOVE LONDON,121,1795.5
SKULLS GREETING CARD,SPACEBOY BIRTHDAY CARD,WHITE HANGING HEART T-LIGHT HOLDER,SWALLOWS GREETING CARD,73,1795.4900000000002
ENAMEL FIRE BUCKET CREAM,WHITE HANGING HEART T-LIGHT HOLDER,ENAMEL MEASURING JUG CREAM,IVORY KITCHEN SCALES,63,1787.29
CHOCOLATE 3 WICK MORRIS BOX CANDLE,GARDENIA 3 WICK MORRIS BOXED CANDLE,ROSE 3 WICK MORRIS BOX CANDLE,ROSE 1 WICK MORRIS BOXED CANDLE,50,1784.1
VINTAGE BEAD PINK EVENING BAG,WHITE HANGING HEART T-LIGHT HOLDER,VINTAGE BEAD PINK PURSE ,VINTAGE BEAD PINK SCARF ,60,1782.7300000000002
FRENCH BLUE METAL DOOR SIGN 9,FRENCH BLUE METAL DOOR SIGN No,FRENCH TOILET SIGN BLUE METAL,PARTY BUNTING,57,1776.48
WORLD WAR 2 GLIDERS ASSTD DESIGNS,WRAP ALPHABET DESIGN,ZINC WILLIE WINKIE  CANDLE STICK,ZINC FOLKART SLEIGH BELLS,60,1776.4199999999996
HOME SWEET HOME 3 PEG HANGER ,HOME SWEET HOME KEY HOLDER,LETTER HOLDER HOME SWEET HOME,SHELF WITH 4 HOOKS HOME SWEET HOME,56,1776.3300000000002
12 IVORY ROSE PEG PLACE SETTINGS,12 RED ROSE PEG PLACE SETTINGS,WHITE HANGING HEART T-LIGHT HOLDER,PLACE SETTING WHITE HEART,62,1775.92
FELTCRAFT HAIRBANDS PINK AND WHITE ,FELTCRAFT PRINCESS CHARLOTTE DOLL,PINK BLUE FELT CRAFT TRINKET BOX,PINK CREAM FELT CRAFT TRINKET BOX ,106,1773.0300000000002
SAVE THE PLANET COTTON TOTE BAG,WOODLAND DESIGN  COTTON TOTE BAG,SPACEBOY LUNCH BOX ,WHITE HANGING HEART T-LIGHT HOLDER,65,1760.7999999999997
SOAP DISH BROCANTE,WHITE HANGING HEART T-LIGHT HOLDER,WHITE BROCANTE SOAP DISH,WOODEN PICTURE FRAME WHITE FINISH,51,1758.35
WOODEN TREE CHRISTMAS SCANDINAVIAN,ZINC METAL HEART DECORATION,ZINC FOLKART SLEIGH BELLS,WORLD WAR 2 GLIDERS ASSTD DESIGNS,88,1756.4100000000003
CHILDS GARDEN RAKE BLUE,CHILDS GARDEN SPADE BLUE,CHILDS GARDEN RAKE PINK,CHILDS GARDEN SPADE PINK,88,1756.1999999999998
SLEEPING CAT ERASERS,SPACEBOY LUNCH BOX ,WHITE HANGING HEART T-LIGHT HOLDER,WOOD STAMP SET THANK YOU,58,1752.75
PETIT TRAY CHIC,WHITE HANGING HEART T-LIGHT HOLDER,SMALL WHITE HEART OF WICKER,POPCORN HOLDER,78,1752.6100000000001
GENTLEMAN SHIRT REPAIR KIT ,VICTORIAN SEWING KIT,SEWING SUSAN 21 NEEDLE SET,TRADITIONAL KNITTING NANCY,80,1749.0900000000001
SPACEBOY TV DINNER TRAY,TV DINNER TRAY DOLLY GIRL,TV DINNER TRAY VINTAGE PAISLEY,VINTAGE SNAP CARDS,65,1737.6500000000005
3 WHITE CHOC MORRIS BOXED CANDLES,WHITE HANGING HEART T-LIGHT HOLDER,ROSE 3 WICK MORRIS BOX CANDLE,WOODEN HEART CHRISTMAS SCANDINAVIAN,64,1735.5
VINTAGE EMBOSSED HEART,ZINC METAL HEART DECORATION,WHITE HANGING HEART T-LIGHT HOLDER,WOODEN PICTURE FRAME WHITE FINISH,58,1733.46
CINAMMON SET OF 9 T-LIGHTS,CLOTHES PEGS RETROSPOT PACK 24 ,ORANGE SCENTED SET/9 T-LIGHTS,WHITE HANGING HEART T-LIGHT HOLDER,103,1732.98
PURPLE PAPER PARASOL,RETROSPOT TEA SET CERAMIC 11 PC ,RED PAPER PARASOL,REGENCY CAKESTAND 3 TIER,51,1730.3999999999999
BANQUET BIRTHDAY  CARD  ,CARD BILLBOARD FONT,"FANCY FONT BIRTHDAY CARD, ",SPACEBOY BIRTHDAY CARD,121,1729.0800000000006
RED METAL BEACH SPADE ,RETROSPOT TEA SET CERAMIC 11 PC ,SET OF 4 PANTRY JELLY MOULDS,VINTAGE SNAP CARDS,69,1724.7
WICKER STAR ,WOODEN HEART CHRISTMAS SCANDINAVIAN,WOODEN STAR CHRISTMAS SCANDINAVIAN,WOODEN FRAME ANTIQUE WHITE ,106,1722.19
MAKE YOUR OWN PLAYTIME CARD KIT,POPPY'S PLAYHOUSE BEDROOM ,POPPY'S PLAYHOUSE KITCHEN,PINK CREAM FELT CRAFT TRINKET BOX ,55,1713.4099999999999
WICKER WREATH LARGE,WICKER WREATH SMALL,WOODEN HEART CHRISTMAS SCANDINAVIAN,WOODEN STAR CHRISTMAS SCANDINAVIAN,93,1712.8299999999997
VINTAGE PAISLEY STATIONERY SET,WHITE HANGING HEART T-LIGHT HOLDER,WOODEN PICTURE FRAME WHITE FINISH,VINTAGE SNAP CARDS,98,1708.78
TEA TIME TEAPOT IN GIFT BOX,TRADITIONAL MODELLING CLAY,WHITE HANGING HEART T-LIGHT HOLDER,TRAVEL CARD WALLET KEEP CALM,54,1705.22
PACK OF 12 BLUE PAISLEY TISSUES ,PACK OF 12 PINK PAISLEY TISSUES ,PACK OF 12 RED RETROSPOT TISSUES ,PACK OF 12 HEARTS DESIGN TISSUES ,150,1701.82
MAGIC DRAWING SLATE CIRCUS PARADE  ,MAGIC DRAWING SLATE DOLLY GIRL ,MAGIC DRAWING SLATE SPACEBOY ,MAGIC DRAWING SLATE DINOSAUR,163,1701.5999999999995
ZINC METAL HEART DECORATION,ZINC WILLIE WINKIE  CANDLE STICK,ZINC T-LIGHT HOLDER STARS SMALL,ZINC T-LIGHT HOLDER STAR LARGE,71,1697.1399999999999
HOME SWEET HOME BOTTLE ,LAVENDER TOILETTE BOTTLE,HOT WATER BOTTLE KEEP CALM,SET 6 SCHOOL MILK BOTTLES IN CRATE,55,1695.88
PACK OF 12 VINTAGE DOILY TISSUES,PACK OF 12 VINTAGE LEAF TISSUES ,SET OF 60 PANTRY DESIGN CAKE CASES ,PAPER CHAIN KIT 50'S CHRISTMAS ,64,1691.1200000000001
TEA TIME DES TEA COSY,TEA TIME OVEN GLOVE,WHITE HANGING HEART T-LIGHT HOLDER,TEA TIME KITCHEN APRON,59,1688.0500000000002
CERAMIC PLATE STRAWBERRY DESIGN,CERAMIC STRAWBERRY DESIGN MUG,LARGE CAKE STAND  HANGING STRAWBERY,MINI CAKE STAND  HANGING STRAWBERY,68,1685.4900000000002
LAUREL HEART ANTIQUE GOLD,LAUREL HEART ANTIQUE SILVER,LAUREL STAR ANTIQUE GOLD,REINDEER HEART DECORATION GOLD,56,1681.19
VINTAGE KID DOLLY CARD ,WORLD WAR 2 GLIDERS ASSTD DESIGNS,VINTAGE SNAP CARDS,WHITE HANGING HEART T-LIGHT HOLDER,61,1680.98
EASTER TIN CHICKS IN GARDEN,EASTER TIN KEEPSAKE,EASTER TIN CHICKS PINK DAISY,SET 3 PAPER VINTAGE CHICK PAPER EGG,59,1674.05
HOME SMALL WOOD LETTERS,WHITE HANGING HEART T-LIGHT HOLDER,WOODEN PICTURE FRAME WHITE FINISH,WOODEN FRAME ANTIQUE WHITE ,61,1670.35
MOTORING TISSUE BOX,RED RETROSPOT TISSUE BOX,SWALLOW SQUARE TISSUE BOX,WHITE HANGING HEART T-LIGHT HOLDER,120,1664.1699999999998
ROSE SCENT CANDLE JEWELLED DRAWER,VANILLA SCENT CANDLE JEWELLED BOX,SET/3 VANILLA SCENTED CANDLE IN BOX,SET/3 ROSE CANDLE IN JEWELLED BOX,51,1663.75
HANGING ENGRAVED METAL HEART,WHITE HANGING HEART T-LIGHT HOLDER,PARTY BUNTING,HEART OF WICKER LARGE,55,1663.3500000000001
SET OF 2 CERAMIC CHRISTMAS TREES,SET OF 2 CERAMIC PAINTED HEARTS ,SET OF 3 WOODEN SLEIGH DECORATIONS,SET OF 3 WOODEN STOCKING DECORATION,93,1662.7499999999995
MAGIC TREE -PAPER FLOWERS,WHITE HANGING HEART T-LIGHT HOLDER,RABBIT NIGHT LIGHT,POPCORN HOLDER,51,1660.69
SET OF 6 3D KIT CARDS FOR KIDS,VINTAGE SNAP CARDS,WHITE HANGING HEART T-LIGHT HOLDER,WORLD WAR 2 GLIDERS ASSTD DESIGNS,85,1649.88
VINTAGE BILLBOARD MUG ,WOODEN FRAME ANTIQUE WHITE ,WOODEN PICTURE FRAME WHITE FINISH,WHITE HANGING HEART T-LIGHT HOLDER,65,1649.1299999999999
WRAP RED APPLES ,WRAP SUKI AND FRIENDS,WRAP VINTAGE PETALS  DESIGN,WRAP VINTAGE LEAF DESIGN,61,1648.0
12 PENCILS TALL TUBE POSY,WHITE HANGING HEART T-LIGHT HOLDER,COLOURING PENCILS BROWN TUBE,JAZZ HEARTS PURSE NOTEBOOK,96,1646.28
4 VANILLA BOTANICAL CANDLES,REX CASH+CARRY JUMBO SHOPPER,SET OF 4 ROSE BOTANICAL CANDLES,4 WILDFLOWER BOTANICAL CANDLES,108,1643.55
ASSORTED CREEPY CRAWLIES,REX CASH+CARRY JUMBO SHOPPER,DINOSAUR KEYRINGS ASSORTED,WORLD WAR 2 GLIDERS ASSTD DESIGNS,71,1641.9399999999996
KIDS RAIN MAC PINK,POSTAGE,RAIN PONCHO RETROSPOT,POPCORN HOLDER,50,1641.6499999999999
JOY WOODEN BLOCK LETTERS,NOEL WOODEN BLOCK LETTERS ,PEACE WOODEN BLOCK LETTERS,LOVE BUILDING BLOCK WORD,72,1629.06
T-LIGHT HOLDER HANGING LOVE BIRD,VINTAGE DOILY TRAVEL SEWING KIT,WOODEN STAR CHRISTMAS SCANDINAVIAN,WHITE HANGING HEART T-LIGHT HOLDER,57,1627.5400000000002
BATHROOM METAL SIGN ,COOK WITH WINE METAL SIGN ,PARTY METAL SIGN ,WASHROOM METAL SIGN,77,1624.05
PANTRY APPLE CORER,PANTRY PASTRY BRUSH,PANTRY WASHING UP BRUSH,SET OF 4 PANTRY JELLY MOULDS,82,1623.8499999999995
CHILDS GARDEN SPADE BLUE,CHILDS GARDEN SPADE PINK,CHILDS GARDEN TROWEL PINK,CHILDS GARDEN TROWEL BLUE ,105,1622.1500000000005
BLOSSOM IMAGES GIFT WRAP SET,CURIOUS IMAGES GIFT WRAP SET,ROMANTIC IMAGES GIFT WRAP SET,VINTAGE PAISLEY STATIONERY SET,115,1621.35
S/4 VALENTINE DECOUPAGE HEART BOX,WHITE HANGING HEART T-LIGHT HOLDER,SET OF 3 HEART COOKIE CUTTERS,SET OF 3 CAKE TINS PANTRY DESIGN ,53,1619.9999999999998
S/4 PINK FLOWER CANDLES IN BOWL,WHITE HANGING HEART T-LIGHT HOLDER,SET/4 BLUE FLOWER CANDLES IN BOWL,SET/6 PINK  BUTTERFLY T-LIGHTS,89,1615.85
LIPSTICK PEN FUSCHIA,WOODEN BOX OF DOMINOES,LIPSTICK PEN RED,POPCORN HOLDER,114,1613.75
MOUSE TOY WITH PINK T-SHIRT,PAPER CHAIN KIT 50'S CHRISTMAS ,REX CASH+CARRY JUMBO SHOPPER,WHITE HANGING HEART T-LIGHT HOLDER,58,1612.8400000000001
200 RED + WHITE BENDY STRAWS,PACK OF 60 PINK PAISLEY CAKE CASES,PACK OF 72 RETROSPOT CAKE CASES,SET/20 RED RETROSPOT PAPER NAPKINS ,87,1611.3500000000001
LOVE HEART TRINKET POT,WHITE HANGING HEART T-LIGHT HOLDER,STRAWBERRY CERAMIC TRINKET BOX,SWEETHEART CERAMIC TRINKET BOX,82,1603.9899999999998
TRAVEL CARD WALLET PANTRY,TRAVEL CARD WALLET TRANSPORT,TRAVEL CARD WALLET SUKI,TRAVEL CARD WALLET VINTAGE TICKET,141,1603.56
BLUE POLKADOT COFFEE MUG,RED POLKADOT COFFEE  MUG,BLUE POLKADOT EGG CUP ,RED POLKADOT BEAKER ,65,1603.5
HEARTS  STICKERS,PACK OF 12 HEARTS DESIGN TISSUES ,SKULLS  STICKERS,WHITE HANGING HEART T-LIGHT HOLDER,78,1600.7699999999995
RING OF ROSES BIRTHDAY CARD,TEA PARTY BIRTHDAY CARD,VINTAGE KID DOLLY CARD ,SPACEBOY BIRTHDAY CARD,96,1596.9600000000003
TEA PARTY  WRAPPING PAPER ,WRAP DOLLY GIRL,WRAP ALPHABET DESIGN,TEA PARTY BIRTHDAY CARD,62,1596.0600000000002
TOADSTOOL MONEY BOX,WHITE HANGING HEART T-LIGHT HOLDER,VINTAGE SNAP CARDS,WOODLAND CHARLOTTE BAG,56,1594.2
RED RETROSPOT SHOPPING BAG,SET/20 RED RETROSPOT PAPER NAPKINS ,ROUND SNACK BOXES SET OF4 WOODLAND ,SET/5 RED RETROSPOT LID GLASS BOWLS,52,1593.67
MONSTERS STENCIL CRAFT,TRADITIONAL MODELLING CLAY,WHITE HANGING HEART T-LIGHT HOLDER,PLASTERS IN TIN SPACEBOY,106,1590.35
SET/4 SKULL BADGES,SET/6 RED SPOTTY PAPER CUPS,SKULLS  WATER TRANSFER TATTOOS ,SKULLS  STICKERS,59,1589.2699999999998
SET/6 COLLAGE PAPER CUPS,SET/6 COLLAGE PAPER PLATES,SET/6 FRUIT SALAD PAPER CUPS,WHITE HANGING HEART T-LIGHT HOLDER,123,1587.0300000000004
4 PEAR BOTANICAL DINNER CANDLES,SET OF 4 ROSE BOTANICAL CANDLES,4 VANILLA BOTANICAL CANDLES,WOODEN STAR CHRISTMAS SCANDINAVIAN,98,1580.6299999999999
EMPIRE TISSUE BOX,MOTORING TISSUE BOX,RED RETROSPOT TISSUE BOX,SWALLOW SQUARE TISSUE BOX,110,1572.9
CHRISTMAS TREE PAINTED ZINC ,STAR DECORATION PAINTED ZINC ,WOODEN TREE CHRISTMAS SCANDINAVIAN,WOODEN HEART CHRISTMAS SCANDINAVIAN,94,1562.56
MINI PLAYING CARDS GYMKHANA,PAPER CHAIN KIT 50'S CHRISTMAS ,PAPER CHAIN KIT VINTAGE CHRISTMAS,MINI PLAYING CARDS SPACEBOY ,93,1562.38
DINOSAUR HEIGHT CHART STICKER SET,PLASTERS IN TIN SPACEBOY,PLASTERS IN TIN WOODLAND ANIMALS,WOODLAND  HEIGHT CHART STICKERS ,50,1560.6000000000001
FRENCH ENAMEL POT W LID,FRENCH ENAMEL WATER BASIN,SET OF 3 CAKE TINS PANTRY DESIGN ,NATURAL SLATE HEART CHALKBOARD ,53,1555.12
"BIRTHDAY CARD, RETRO SPOT","FANCY FONT BIRTHDAY CARD, ",CARD BILLBOARD FONT,SPACEBOY BIRTHDAY CARD,120,1550.7199999999998
CREAM FELT EASTER EGG BASKET,GARLAND WOODEN HAPPY EASTER,EASTER CRAFT 4 CHICKS ,WHITE HANGING HEART T-LIGHT HOLDER,56,1547.8999999999999
PINK METAL CHICKEN HEART ,YELLOW METAL CHICKEN HEART ,SET OF 3 CAKE TINS PANTRY DESIGN ,WHITE HANGING HEART T-LIGHT HOLDER,52,1542.5900000000001
PENS ASSORTED SPACEBALL,SET OF 3 CAKE TINS PANTRY DESIGN ,RED RETROSPOT CHARLOTTE BAG,SPOTTY BUNTING,53,1542.5300000000002
RED HEART SHAPE LOVE BUCKET ,SET OF 3 HEART COOKIE CUTTERS,SET/20 RED RETROSPOT PAPER NAPKINS ,SET/5 RED RETROSPOT LID GLASS BOWLS,58,1541.0700000000002
CHOCOLATE CALCULATOR,TOOTHPASTE TUBE PEN,PACK OF 12 TRADITIONAL CRAYONS,RETROSPOT TEA SET CERAMIC 11 PC ,59,1534.6999999999996
